argument,score
Homemade children receive a good education and it is the right of parents to train them as they see fit,0.841126921
Homeschooled students do not learn the necessary social skills,0.67522554
Homework support can create a more independent program.,2.75e-05
"Homework does not educate children in the way they should be brought up, which often means that they lag behind those of their own age.",0.780880761
Homeschooling offers bullied and abnormal children a way to learn without bullying.,0.680706433
"Attending school deprives a child of valuable life-saving measures, especially interaction with his or her own age group and all the resulting experiences.",0.999513923
"Homeschooling should not be banned at all, because parents have the freedom to raise their child as they see fit. If they think they can do a better job of teaching their child, they have every right to do so.",0.917098651
Homework supervision enables a circulation system that meets the specific needs of a child and saves the state money.,0.995402342
"The homework supervision allows the child to visit a fountain while sitting comfortably, thus benefiting from one lesson to the other and reducing the stress caused by bullying and peer pressure.",0.924082734
Homeschooling enables one-on-one teaching of a well and allows a student to learn in a safe environment,0.964006228
Homeschooling enables targeted education in a safe environment.,0.974874819
Homeschooling enables motivated students to learn more than they would learn in traditional schools.,0.609125162
Homeschooling enables parents to teach with methods that are best suited to their child's way of learning,0.900608196
"Homework supervision allows parents to prioritize issues that are important and necessary, rather than the flow that comes through the school system.",0.360518783
Homeschooling enables parents to keep their children away from society.,8.19e-05
Homeschooling enables parents to offer an education that fully corresponds to their faith.,0.843771503
Homework supervision enables the child to receive more direct instruction and can be completed at his or her own pace and not at the pace of others.,0.998297885
"Home tuition can allow parents to opt for a standardized curriculum, which means that their child receives an inferior education that does not prepare them for adult life.",0.956587088
"Homework help can be useful for children who have special needs, such as people with mental health or physical needs.",0.932000693
Homeschooling may be best for those with alternative learning needs,0.883046708
Homeschooling can be good for kids who have problems at school,0.266317985
The homework support can be tailored to the individual needs of the child.,0.98578811
Homeschooling can be used to conceal child abuse because no teacher sees that they are reporting it.,0.540782774
Homeschooling can be used to teach children unusual and extreme religious and political ideas.,0.496694076
Homeschooling can be useful when a child is bullied at school and needs protection from their bully.,0.995805316
Homeschooling can lead to better learning outcomes for many children struggling in the traditional classroom.,0.881847255
Homeschooling can lead to children not building the social bond with their peers that they should.,0.75522461
Homeschooling can lead to children not knowing the curriculum and therefore having a hard time later in life.,0.446614666
Homework supervision can offer more individual attention and allow the child to learn at his or her own pace.,0.999678514
Homeschooling can provide a more pleasant environment for the child and protect them from all the evils of society such as bullying.,0.842846081
"If their parents are not intelligent enough to ensure a good education, they may be disadvantaged by attending home schooling.",0.419114557
Homeschooling cannot provide the quality of education that real teachers and a real school can provide.,0.910173137
"Homeschooling results in a child not getting the right education they need, because parents are in control of what they learn and what they don't.",0.49893056
Homework supervision leads to a decline in education.,0.018517303
"Homeschooling makes children smarter because they have a one-to-one education, giving them more time to learn and learn.",0.248974375
"Homeschooling causes stunted social skills in children, causing greater problems for them as adults.",0.884615962
Homeschooling leads young people to isolate themselves from their peers,0.966586865
A child who goes to school at home produces children who have no social skills and will not be able to work with other people at work.,0.999011382
Homework counseling shuts child from creating a relationship with others their age,0.537459637
Homework tutoring shuts students out of peer-to-peer interaction,0.919228617
"Homework guidance leads to similar, if not better, results than traditional schools",0.881082023
Going to school at home deprives the child of an adequate education and is isolating and should be banned.,0.749094779
The homework help deprives the child of socialisation and friendships.,0.973436076
Homework deprives children of indispensable social interaction with their peers.,0.992923969
Homeschooling deprives the child of learning social behavior and norm.,0.936717895
Homeschooling deprives the child of the benefit of a well-regulated education.,0.895484205
Homework help does not allow the child to fully develop his or her social relationship.,0.967281966
Homework supervision does not allow the child or child to socialize with other peers.,0.99955376
