argument,score
Companies should be able to do everything they need to attract the best talent.,0.839362058
"Companies should be able to pay a multiple as long as they like, as long as it is above the minimum.",0.024881658
Companies should be allowed to call random people on the phone if it helps their business,0.517535174
Companies should be allowed to pay their employees a multiple of what they want.,0.988424163
Businesses should ban cold calls and be forced to comply with their customers' request not to take part in advertising calls.,0.834322505
Companies should be free to pay executives the way they want,0.077342586
"Companies should be able to run freely, as they see when no one comes in to supervise how they operate.",0.019160577
Companies that have properly researched and developed a new product must be protected so that research costs can be recovered.,0.033298033
"Without this aggressive approach, the company will close, and that would mean the loss of jobs.",0.007343751
Companies with mandatory pension policies could avoid going old-fashioned and obsolete by constantly supplying their workforce with new talent.,0.977182763
Companies would not be able to compete fairly for the best candidate if the remuneration of managers were limited.,0.890271218
COMPANIES GROW BECAUSE BONUS MANAGEMENT SCHEMES,4.68e-05
"Compared to monogamous women, women in polygamous marriages are much more likely to suffer abuse, depression, and poverty.",0.998721937
The compensation of the executive is necessary because it is support for a mass of people without whom the economy would not be in the privileged position it was in.,0.000505812
Competition could be fairer in this way.,0.097786306
Compulsory voting is a patriotic act which must be fully respected.,0.192791724
Mandatory assistance to involve people in the electoral process.,0.045104924
Compulsory retirement is necessary and fair because it gives workers the opportunity to enjoy their old age without having to complete a working day.,0.110901193
Compulsory voting would give everyone a voice in the election,0.73544991
Compulsory voting gives all citizens the chance to make a difference,0.946956507
Compulsory voting can contribute to better election results,0.946162081
Compulsory voting could also be something like a census to count people.,0.577304547
Compulsory voting could be a way of controlling the population and ensuring that everyone has an up-to-date ID card.,0.168193511
Compulsory voting could improve people's knowledge of politics if they knew they had to vote to learn more about politics.,0.559932533
Compulsory voting could improve the electoral process by ensuring that the candidate or party with the broadest cross-generational support wins.,0.997186786
Compulsory voting could lead to an uninformed public electing unqualified people to office,0.561273938
"Compulsory voting does not promote democratic engagement, but rather voting in a tick box",0.545371859
Compulsory voting does not ensure that citizens are better informed about their vote,0.284317897
Compulsory voting educates the population.,0.775373738
Compulsory voting ensures that all votes are counted,0.950623929
"Compulsory voting ensures that all eligible voters have a say in the election, rather than letting only a part of the population decide",0.660399396
"Compulsory voting ensures that our leader reflects the will of all people, not just those who were able / motivated enough to make it to the ballot box.",0.989293915
Compulsory voting ensures that the winner is truly representative of the entire population.,0.999981186
"Compulsory voting forces voters with little information into the system, which can only vote for candidates who promise free service.",0.022001948
Compulsory voting forces people to face up to democracy,0.238939926
"Compulsory voting obliges citizens to pay attention to the policies that affect them and to decide accordingly, rather than leaving control of policy to specific groups.",0.070140033
Compulsory voting gives everyone a say in the election,0.264613227
Compulsory voting gives everyone in society a say in politics,0.742472898
Compulsory voting is contrary to people's freedom and liberty.,0.614836122
Compulsory voting is contrary to the freedom of the country in which everyone can decide for themselves what they do and what they do not do.,0.918357647
Compulsory voting goes against what democracy stands for,0.939420864
Compulsory voting significantly increases turnout,0.838631728
Compulsory voting improves turnout.,0.873023854
Compulsory voting vastly increases turnout,0.681974674
Compulsory voting infringes on our freedom.,0.86830817
"Compulsory voting violates people's right not to vote when they protest against a plethora of things, such as the electoral system, corruption in government, etc.",0.981319621
Compulsory voting violates the right to privacy.,0.884543423
"Compulsory voting is a foolish idea. If people are not already voting, it is obvious that they are not interested in politics and their more than likely uneducated voice should not be included.",0.884364143
Compulsory voting is a must to ensure that the voice of all people is heard.,0.73015487
Compulsory voting is a violation of civil rights,0.929818715
"Compulsory voting is a violation of free will, and the government should not violate a person's freedom of choice.",0.739904401
"Compulsory voting is against freedom, everyone has the right to choose whether or not to vote in a free and open society.",0.523274617
Compulsory voting is against our right to freedom.,0.608807543
Compulsory voting is an encroachment on personal autonomy,0.965210325
Compulsory voting is an infringement of personal freedom of choice,0.999583744
Compulsory voting is contrary to our civil right,0.039175175
"Compulsory voting is a complete violation of the democratic process, which is that freedom of action and expression, which imposes everything on a person, is wrong.",0.999638639
"Compulsory voting is inconvenient, especially for people with mobility problems or who simply cannot take time off from work to vote.",0.928552409
"Compulsory voting is necessary in order to truly reflect the will of the people. If people do not participate, they can announce by post that they did not vote out of indifference, but out of inaccessibility.",0.839713186
"Compulsory voting is not a democratic choice, because people should always be allowed to express their dissent by abstaining.",0.999823577
"Compulsory voting is not the answer, because those who do not care or who do not know exactly what they are voting for can simply vote for something random, even if they are ultimately opposed to what they are voting for.",0.963478203
Compulsory voting is not only ridiculous but also impossible to enforce.,0.258299303
Compulsory voting is the only way to get people to participate in the elections that are necessary for the real leadership of a country.,0.809423274
"Compulsory voting is unconstitutional, and forcing people to do something they don't want to do is never planned.",0.206731575
Compulsory voting ensures a more reliable election result,0.988017595
Compulsory voting ensures more informed voters,0.881877064
Compulsory voting ensures that everyone can vote on who and how leads their government.,0.999494174
Compulsory voting would involve the population more in the electoral process and provide a result that more accurately reflects the will of the voter.,0.718278946
"Compulsory voting can make the election a national holiday, eliminating the pervasive problem of people not being able to leave work to vote.",0.00859922
Compulsory voting means people can complain if the election doesn't go their way,0.069365861
"Compulsory voting means that politicians must address the concerns of the entire electorate, rather than just focusing on the group of people who normally go to the polls",0.925414794
"Compulsory voting is not prohibited, a people should choose whether they want to vote, and it will annoy people if they are forced to do something.",8.32e-05
Compulsory voting weighs on the freedom of the individual,0.351157626
Compulsory voting should be introduced because it involves everyone in the electoral process and makes all voices heard; we have such a low turnout that we do not get an accurate result.,0.889944487
"Compulsory voting should be introduced, the more people vote, the better for democracy and means that the government that is elected is representative.",0.012659656
Compulsory voting should be introduced because it actually increases turnout.,0.9382455
Compulsory voting should be introduced to ensure that the election result is fully representative of the population.,0.998353689
"Compulsory voting should not be introduced, as voting is not compulsory. I have the right to vote, but I am not obliged to vote. If I do not like the candidate, I can decide not to vote.",0.998480699
"Compulsory voting should not be necessary, because people vote for everyone without exploring what might distort the outcome.",0.528369369
"Compulsory voting should not be introduced because it forces undecided people to vote for a randomly chosen people, ruining the quality of the election",0.023122164
Compulsory voting should not be introduced because it violates freedom of choice.,0.944039505
"Compulsory voting sounds compulsory, and many people choose not to vote.",0.000754908
Compulsory voting deprives individuals of the right to their own opinion,0.284567611
Compulsory voting deprives people of the freedom to choose whether they want to vote or not.,0.990740139
Compulsory voting takes into account the voice of all people.,0.457855765
Compulsory voting violates our right.,0.762276393
Compulsory voting violates freedom of choice.,0.52656
It will be difficult for the elderly and others who will find it difficult to vote to enforce compulsory voting.,0.682275376
Compulsory voting will make more people feel that the government has too much power and the country will feel free,0.048971828
"Compulsory voting will lead to more people becoming interested in politics, which will benefit everyone",0.819738779
"Compulsory voting removes voter suppression, which is a big problem in this country",0.977854186
Compulsory voting will ensure the proper outcome of an election.,0.019979707
"Compulsory voting forces citizens to vote, even if they do not understand the system and therefore cast a false ballot.",0.986215199
Compulsory voting will improve voter turnout and ensure that everyone is fairly represented.,0.98268363
Compulsory voting will raise people's awareness of political issues,0.680553601
Compulsory voting will increase voter turnout.,0.374931505
Compulsory voting will ensure that everyone has a voice and a say.,0.267595681
"Compulsory voting will lead to a much more representative system of Parliament, since the voice of all will be taken into account.",0.810991758
Compulsory voting offers itself to uninformed voters.,0.903702896
Compulsory voting will make elections fairer.,0.230501582
Compulsory voting will lead to more people getting involved.,0.491954164
"Compulsory voting will represent all people, not just those who already vote",0.109333888
Compulsory voting will not result in more people going to vote. Voting restrictions are already a decision they have made not to vote for any of the candidates.,0.162346741
Compulsory voting would be an effective antidote to the oppression of voters. More turnout ensures a healthier democracy.,0.939367679
"Compulsory voting would be beneficial because more people would be interested in politics, which would create fairer representation in government.",0.855378905
"Compulsory voting would result in people with little or no information casting their votes on the basis of a stupid name, while they know nothing about the candidate's attitude to anything.",0.655610978
Compulsory voting would end with a botched result from people who don't care who they vote for.,0.024692879
"Compulsory voting would ensure a higher turnout, enabling a much more accurate representation of the population",0.869980732
Compulsory voting would increase public political activism,0.969402848
Compulsory voting would ensure that our elected official properly represents the entire population,0.904314806
"Compulsory voting would ensure that everyone participates in the political process, and it would be the true voice of the people, not the voice of the voting minority.",0.77393778
Compulsory voting would ensure that everyone would vote and have a say in what happened.,0.760405574
"Compulsory voting would ensure that more people are heard in elections, which would allow for a fairer election.",0.999697076
"Mandatory voting would ensure that no one can claim they have no say or argue that a noisy minority wins a silent, non-voting majority.",0.670997285
Compulsory voting would ensure that the person or party elected is the one who enjoys the greatest support from the entire electorate.,0.992561101
Compulsory voting would ensure fair and equal elections,0.340370224
Compulsory voting would level the field for undecideds,0.211427643
Compulsory voting would force those who disagree with the candidate to vote for someone they do not trust.,0.821563176
Compulsory voting would involve everyone,0.146605543
Compulsory voting would provide an exact figure on how people vote,0.01197197
Compulsory voting would help put an end to electoral fraud.,0.307083811
Compulsory voting would encourage political activism,0.843755814
Compulsory voting would boost turnout,0.989052327
Compulsory voting would increase turnout.,0.863184054
"Compulsory voting would ensure that everyone has a say in voting, and would be a way to abolish compulsory voting; compulsory voting would be a more precise voting system for the people's vote.",0.527476768
Compulsory voting would ensure that every citizen entitled to vote can help whoever he or she wants for political office.,0.292531556
Compulsory voting would lead to more deserving politicians being elected to office.,0.660877215
Compulsory voting would ensure that everyone would vote in every election.,0.009370663
Compulsory voting would ensure that the voice of every individual is heard and provide a more precise system to ensure that the elected person is the one the people really want.,0.856050934
"Compulsory voting would ensure that the votes of all are counted, not just those typically engaged in political matters.",0.742472898
Compulsory voting would make electoral practice fairer.,0.743322396
Compulsory voting would take into account the opinion of all.,0.828277912
"Compulsory voting would make the election even more significant, because so many people would vote out of necessity rather than real desire or knowledge.",0.880758462
Compulsory voting would mean our electorate would be more representative of our Valley.,0.058100081
Compulsory voting would mean that every vote is heard and every vote counted.,0.996907104
Compulsory voting would mean that the government reflected the people's thoughts more truthfully.,0.937301291
Compulsory voting would mean that the true voice of the country would be heard and everyone would vote,0.828610682
"Compulsory voting would only lead to uneducated voters casting their ballots, and would be of no real benefit to the country.",0.62226634
Compulsory voting would encourage the public to take responsibility for electing their elected official.,0.970241185
Compulsory voting would require everyone to participate in our democracy and ensure that a candidate is elected by more than the 10 or 20% of the population who vote.,0.556772033
Compulsory voting would require people to vote who really have no idea or care about the issue they are voting on. We need an informed population to keep our democracy strong.,0.661747575
"The compulsory vote would saturate the poll with a new face, bring about more change and a better result.",0.037469509
"Compulsory voting would ensure that in every area of our government we have the person that the people, the whole people, really want.",0.023786134
Forced wouldn't work because some people would just leave it blank or check something,0.019579374
Computers are much more reliable than people. They know with a computer that they won't fall asleep or be distracted by a call.,0.464669641
The concentration of a large number of people and resources increases pollution and teaches the well-being of citizens.,0.590506237
"The conditions for surrogacy are often abusive and obsessive, so it is up to us to end this exploitative practice.",0.940360439
The condition of the children in foster care sometimes put them in an even worse situation than they originally were.,0.790893657
"The condition present at birth, which can be corrected by plastic surgery, includes patients with cleft lips or palate, hypospadia...",0.794109352
Keeping animals in tight spaces is cruel.,0.861031258
Congress does not support the flag-burning ban and has repeatedly shot down attempts to enshrine it in law.,0.00869979
The bond between God and people who live in celibacy is unbreakable and should remain so.,0.423498837
Consensus can be difficult in a multi-party system,0.935205025
Consenting adults should be able to marry many people they want,0.889244201
"Given that there are more women in the world, polygyny would give more of them the chance to get married.",0.60910967
"Further development means that even if autonomous cars are not viable, more discoveries and progress can be made",0.973501673
"The progressive development of autonomous cars is causing too much unemployment, from the people who build cars, who spend part of their careers driving taxis and Uber cars, to mechanics and race car drivers.",0.260234714
"Conventional medicine often overlooks other areas of wellness such as nutrition, exercise and supplements. Naturopathy ensures that someone pays attention to the other components, which are often just as important.",0.997233591
Traditional television is losing its place in the home of the modern family and is being replaced by a streaming service that should be seen as a successor to the television we should be moving towards.,0.197346973
"The sentence is still overturned 30 years later; if these people had been executed, it would have been too late",0.984157636
Avoiding armed conflict when one country terrorizes others through economic sanctions is a great way to get that country back to cooperation.,0.594523934
Police officers should be free to use their own discretion,0.053167153
Copyright protects artistic creation.,0.523593313
"Companies should decide for themselves whether they want to keep an employee because they are the ones directly affected, and compulsory retirement interferes with companies' rights.",0.616776634
"Corrupt governments must be overthrown by the people, and economic sanctions can help achieve this.",0.369842468
Corrupt judges could use this activism too much to block important projects for their own profit,0.975719065
Cosmetic procedures for minors should be allowed if bullying on the basis of appearance can cause lifelong harm to the individual.,0.92162137
Cosmetics should be banned for minors because they are too immature to make the decision,0.847029806
"Cosmetic surgeon promotes hedonism, hypersexuality and sends the wrong message to young girls",0.999721508
Cosmetic surgery should not be performed on minors as their body is still developing.,0.99995267
"Cosmetic surgery helps with reconstructive surgery, such as mastectomy or physically repairable birth defects.",0.963094166
Cosmetic surgery allows the injured or otherwise deformed to feel better about themselves when they regain some of their natural appearance.,0.998540532
Cosmetic surgery a minor make it more likely that you will have to go in for follow-up an adult to correct or correct the problem with this past surgery.,0.03728362
Plastic surgery as elective surgery has no basis for being allowed to become a minor.,0.897984225
"Cosmetic surgery and elective surgery should be banned, because they only promote the stereotype and vanity of popular culture and are of no real value to anyone.",0.998557668
Plastic surgery helped many accident victims recover their injuries and lost part of their bodies.,0.115628592
Cosmetic surgery boosts people's self-esteem.,0.998738209
Cosmetic surgery can allow minors to feel normal if they have a non-health-related defect.,0.087489323
"Cosmetic surgery can also cause more damage if an implant, like a breast implant, sheds and could potentially harm the patient.",0.020217974
Plastic surgery can be addictive and people do it until they look deformed.,0.999390472
Plastic surgery can be addictive and some people turn into plastic dolls.,0.502636061
Cosmetic surgery can be dangerous and sometimes death. It reinforces the belief in the social standard of beauty. It can bully our teenagers and become very lucrative for the doctor who promotes it.,0.941653226
Cosmetic surgery can be indispensable for people with birth defects in order to lead a normal and sufferable life.,0.827686912
Cosmetic surgery can be good for many things when it comes to saving a patient's life.,0.716696509
"Plastic surgery can be the key to a child's self-esteem, and the state should not regulate it.",0.007623653
"Cosmetic surgery may be necessary in certain circumstances, such as when a child has a facial deformity after an accident.",0.859389523
Plastic surgery can be permanent and minors cannot understand the full consequences before committing it. They should wait until they are adults before making a decision.,0.823381364
Plastic surgery can be very dangerous and is not regulated as much as it should be.,0.157880591
Cosmetic surgery can be vital for people whose self-confidence is affected by their appearance.,0.969560345
Cosmetic surgery can in many cases be addictive and lead to health problems and debt.,0.753170135
Cosmetic surgery can boost self-confidence,0.771000913
Cosmetic surgery can boost confidence,0.319778008
Cosmetic surgery can cause harmful side effects that can be crippling for children.,0.947753498
Plastic surgery can cause health problems later on,0.241049035
"Cosmetic surgery can cause long-term health problems, especially in children.",0.934299213
Cosmetic surgery can cause long-term medical problems,0.723947542
Cosmetic surgery can cause medical problems.,0.742688101
"Plastic surgery can do more harm than good and, if not done properly, can damage a person for the rest of their life. It can also take up the operating rooms needed for emergency surgery.",0.255704155
Cosmetic surgery can cause people to become addicted to procedures they don't need.,0.593501598
Plastic surgery can correct physical defects in children and allow them to live a normal life,0.763517615
Plastic surgery can give a person confidence and help them overcome the feeling of inadequacy,0.665625775
Plastic surgery can go horribly wrong and make people look and feel worse than before.,0.827824884
"Cosmetic surgery can have a huge impact on self-esteem, and minors should be able to benefit from it.",0.738336439
Cosmetic surgery can have lifelong consequences.,0.679436369
Cosmetic surgery can have really harmful side effects that minors cannot agree to and will not be able to physically handle as adults.,0.999159443
Cosmetic surgery can have serious medical consequences and is largely unregulated in an industry.,0.937717847
Cosmetic surgery can help many people who have been disfigured or have a poor body image,0.969964783
"Cosmetic surgery can help minors who have suffered a physical defect or injury, and cosmetic surgery can help restore not only their physical but also their emotional well-being.",0.999576025
Cosmetic surgery can help build self-esteem,0.965754146
"Cosmetic surgery can help by correcting something someone doesn't like, to give them more confidence.",0.317518829
Cosmetic surgery can help improve self-image in the event of deformities and injuries that have left physical damage that can be repaired with this type of procedure.,0.86294088
Cosmetic surgery can help boost a person's self-esteem,0.995376318
Cosmetic surgery can help patients feel better.,0.483234393
Cosmetic surgery can help people feel better about themselves,0.531208487
Cosmetic surgery can help people with facial injuries or birth defects look more normal,0.670397583
"Cosmetic surgery can help people with deformities. It can improve their lives, make them more comfortable in the social environment. Medical Association can check physician for excessive surgery, no need to ban them",0.48046343
Cosmetic surgery can help people with self-esteem,0.707045361
Cosmetic surgery can help self-esteem,0.118733668
Cosmetic surgery can help some people who are so preoccupied with their appearance that they let it affect their mental wellbeing,0.53493033
Cosmetic surgery can help alleviate medical and mental health problems,0.788664687
Cosmetic surgery can help young people with deformities,0.867880286
"Plastic surgery can improve a person's emotional state by boosting self-esteem, which is important for their mental health.",0.857984891
"Cosmetic surgery can involve complex, dangerous medical procedures that should not be performed for medical reasons.",0.813570166
"Cosmetic surgery can cause bodily problems over time. It is not a 100% safe treatment and will only endanger human lives, but will no longer be worth it.",0.010550765
"Cosmetic surgery can lead to complications such as blood loss, blood clots under the skin or infections if the patient does not adhere to strict postoperative treatment.",0.469146514
"Cosmetic surgery can lead to damaged tissue in the body of people undergoing this treatment, which can lead to unforeseen problems that can lead to death.",0.846181565
Cosmetic surgery can lead to fatal complications.,0.538643301
Cosmetic surgery can lead to serious side effects such as cancer.,0.797000269
