argument,score
Cosmetic surgery can permanently damage a person's appearance.,0.732390618
Cosmetic surgery can make a huge difference in the way people think about themselves and lead to a higher quality of life.,0.907106223
Cosmetic surgery can make a huge difference to those who have a problem with self-esteem because of their appearance.,0.905029558
Cosmetic surgery can create confidence and everyone should have the right to feel comfortable.,0.455800247
"Cosmetic surgery can solve the problem of bullying and harassment, preventing long-term mental health trauma.",0.631373009
"Plastic surgery can lead to painful complications and health problems, are costly and promote the damaging notion that image is paramount.",0.993530524
Cosmetic surgery can sometimes cause damage and have catastrophic consequences.,0.006921504
"Cosmetic surgery can prevent children from falling victim to bullying, which can cause long-term mental health problems.",0.17000195
Cosmetic surgery involves unnecessary risks and deprives the cure of real diseases of resources.,0.923899104
Plastic surgery causes unnecessary risk for the patient in a purely narcissistic procedure.,0.850325727
Cosmetic surgery contributes to the emotional problem of low self-esteem and is an unnatural procedure with various health risks.,0.912319091
"Cosmetic surgery contributes to the mythical ideal body, the pursuit of which causes depression, anxiety and eating disorders in young people.",0.934531336
Cosmetic surgery corrects defect either by birth or accident,0.999991427
Cosmetic surgery corrects people's negative self-image.,0.552581103
"Cosmetic surgery could help some minors overcome the issue of self-esteem, which can damage their mental health.",0.946588139
Cosmetic surgery could cause unforeseen problems for young people whose bodies are still growing and maturing,0.994248048
"Cosmetic surgery generates a great desire for physical improvement, which leads to an endless loop of body adjustment that is detrimental to the individual.",0.985082711
Cosmetic surgery creates an unhealthy body image in the medium to which children try to adapt.,0.883920304
Cosmetic surgery creates an unhealthy self-image,0.886625591
Deciding on plastic surgery requires the consent of an adult and should not be imposed on minors before their consent age.,0.819102056
Cosmetic surgery promotes low self-esteem and an unrealistic ideal. Young women are emotionally damaged by the flood of surgery results they cannot afford.,0.923363525
Cosmetic surgery encourages people to change things that don't need to be changed.,0.856613362
Cosmetic surgery promotes concentration on appearance and unattainable beauty norm,0.287326459
Cosmetic surgery imposes Western standards of beauty on children and erases their culture and identity.,0.718563901
Cosmetic surgery boosts self-confidence in life,0.153205953
Cosmetic surgery exists out of vanity Doctor who offers this service should focus on treating people with real diseases,0.51027954
"Cosmetic surgery for beautification is unnecessary for minors, as their body has not yet fully developed.",0.528603734
Cosmetic surgery for minors should be allowed because some people need correction to help them feel better about themselves.,0.898982671
"Cosmetic surgery for minors can help to overcome physical and mental problems, which are not merely cosmetic, but medically advantageous.",0.513637112
Cosmetic surgery for minors can help people with deformities achieve a more normal appearance,0.527081618
"Cosmetic surgery for minors contributes to a culture of instant gratification, rather than working on your problem and learning to deal with it over a longer period of time, but with a more stable outcome.",0.9175205
"Cosmetic surgery for minors contributes to the erasure and aversion to ethnic traits (such as eyelid surgery, which Asians are often forced to undergo), which contributes to people's hatred of their culture and race.",0.673108821
"Cosmetic surgery for minors thwarts all the positive messages and advances of the social movement, which advocates self-love and self-acceptance.",0.999288774
Cosmetic surgery for small deer does not address the problem of self-esteem and the results of cosmetic surgery are irreversible.,0.817888675
Cosmetic surgery for minor cases increases overall demand and increases the cost of surgery for people who really need it.,0.75919627
Cosmetic surgery for minors is a manipulative practice,0.300899965
Cosmetic surgery for minors is an unnecessary and potentially dangerous medical procedure carried out at an age when the person is unable to calculate the long-term consequences.,0.921062654
"Cosmetic surgery for minors is completely unnecessary, traumatic and invasive.",0.993689401
Cosmetic surgery for minors is dangerous because they are not emotionally advanced enough to understand the long-term effects and effects.,0.947444722
"Cosmetic surgery for minors is dangerous, can have long-lasting consequences and teach a bad value in terms of body image.",0.770126947
Cosmetic surgery in minors is important because it can help with self-esteem.,0.75730947
Plastic surgery on minors is unnecessary and dangerous and normalizes at a young age.,0.73176145
Plastic surgery on minors is unnecessary and dangerous.,0.999446524
Cosmetic surgery for minors is unnecessary because it is still in development.,0.489134501
Underage cosmetic surgery makes children believe aesthetics are more important than who they are inside and should be banned,0.952139077
