argument,score
Collectivism could suppress the legitimate need to support certain groups more than others who are currently suffering inequality because of years of discrimination.,0.941271665
Collectivism causes individuals to lose all self-esteem and the ability to think for themselves.,0.998703095
Collectivism creates society that is useful to tyrants,0.005770922
Collectivism diminishes individual rights by forcing them to conform to what the group considers best,0.348517325
"Collectivism denies the individual his or her personal freedom to express himself or herself, to think for himself or herself, and to give his or her personal best.",0.913254946
Collectivism refuses to accuse people of working hard to achieve their own prosperity.,0.809636839
"Collectivism disregards the individual and focuses on the group, so it would be easy for an individual to lose for the greater good of the group.",0.990212262
"Collectivism does more harm than good, because isolating individuals is not appropriate and they should be important as individuals and not as part of the group.",0.624141262
Collectivism does not permit individual thinking,0.399585639
Collectivism does not permit individual entrepreneurship and stifles entrepreneurship.,0.971123663
Collectivism does not allow people to be the best they can be.,0.773494365
Collectivism does not allow the right of the individual and leaves him open to abuse by his government under the guise of prioritizing what is best for the group.,0.917894606
"Collectivism does not allow individuals to do what they enjoy in their careers, which leads to depression",0.559969057
"Collectivism does not allow one person to stand out from the other, which can be negative",0.544683033
Collectivism does not allow people to be all they can be,0.001262226
Collectivism does not encourage individual improvement and ingenuity,0.999896076
"Collectivism does not reward individuals for hard work that robs people of the opportunity to improve their lives through their dedication and will, and that is ultimately unfair.",0.983434252
Collectivism does not allow individual opinion and discourages free thinking,0.66044441
Collectivism does not allow people to stand up for what they believe in alone,0.55891001
Collectivism enables the community to work together for the common good.,0.756828227
"Collectivism encourages all members of a group to contribute to the well-being of the community, and in turn raises the standard of living for all, thereby eliminating inequality and resentment between unequal groups.",0.993178546
Collectivism promotes groupthink and kills individuality and is not good,0.71140324
Collectivism promotes herd mentality,0.811680224
Collectivism promotes laziness and lack of ambition by rewarding everyone equally,0.998795494
Collectivism encourages the group to work together for the common good of all,0.832722363
Collectivism promotes cooperation and the achievement of goals for society and ensures that all needs are met jointly and not just certain individuals.,0.897616127
Collectivism increases the happiness of society as a whole by focusing on the best for all.,0.946083976
"Collectivism ensures that all people are on the same page, which is more effective when it comes to improving their community",0.713161161
Collectivism ensures that a larger group of people is able to live a sustainable life,0.478764665
Collectivism ensures that every citizen has what he needs to survive.,0.993441564
Collectivism ensures that everyone can work if they wish.,0.422188549
Collectivism ensures that everyone is taken care of,0.625568754
"Collectivism provides the most efficient and useful allocation of resources, because it does not allow individuals to accumulate huge surpluses while others disappear without satisfying their basic needs.",0.999768725
"Collectivism undermines individuality and oppresses the individual, so we should stand firm against it.",0.578381242
Collectivism excludes people who do not think alike.,0.315899595
"Collectivism focuses on one group, while ignoring others in dire need.",0.000274008
Collectivism focuses on the group as a whole and reduces the rights of the individual.,0.989034065
Collectivism forces people to forge stronger bonds with their community and ultimately to improve themselves by feeling the need of others above themselves.,0.821991835
Collectivism gives certain people an unfair advantage based on something they cannot control.,0.784609729
"Collectivism gives more power to the people of a state, which can only be a good thing: the people would be in control of many other areas of their lives, not the government.",0.62278855
Collectivism gives one voice a louder voice by making others available for support,0.118946806
Collectivism gives people something to work on as a team and build relationships with.,0.907722077
Giving priority to collectivism over individual needs would be very unfair to a person who might have a higher or different need than the majority of the group.,0.535935616
Collectivism gives the group the opportunity to control more and become stronger.,0.75053014
Collectivism directly contradicts the right of the individual. Individual freedom is what this country was founded on. It is right to put the majority above the individual.,0.87694667
Collectivism has been around for as long as the world has existed and will always be present and supported.,0.003075704
Collectivism has the potential to significantly improve the quality of life of our country's citizens and should not be neglected so quickly.,0.701784327
Collectivism helps bring people together,0.88385412
"Collectivism helps companies deal with a large number of employees at once, allowing them to have more time for their work.",0.522352227
Collectivism helps create herd mentality,0.008863782
Collectivism helps to encourage those who are in the minority and who may not be able to have the luxury that others may have.,0.864610491
Collectivism helps everyone to achieve something better.,0.189557502
Collectivism helps to get the opinion of everyone.,0.06104036
"Collectivism helps people form a group and look at the picture as a whole, rather than just individuals.",0.400356019
Collectivism helps to share the burden of responsibility in order for a society to prosper,0.740796243
"Collectivism helps keep everyone in line, as the group can ban anyone who drops out.",0.370426987
"Collectivism impedes progress, not rewards the thinker and doer who helps us move forward",0.552211914
Collectivism blames everyone for the actions with which they wanted to hang themselves,0.632336356
Collectivism has wounded the unique personality of all.,0.912879968
"Collectivism influences the autonomy of individuals the most, and decisions are usually made according to what is considered acceptable by the group.",0.698818099
Collectivism imposes the will of other people on the individual and therefore violates fundamental human rights.,0.742472898
"Collectivism improves the cohesion of society and ends the greedy, selfish backbone of capitalism, where people are more caring and supportive of each other.",0.706454932
"Collectivism impedes freedom of expression and puts the larger group before itself, a system open to abuse and capable of allowing censorship and fascism to fester.",0.926831742
Collectivism impedes individual ability and freedom of expression,0.9430364
Collectivism inhibits personal expression and can foster censorship and fascism.,0.999515522
Collectivism is a bad way to advance a nation. A lazy person will benefit from other hard work and contribute nothing himself.,0.97636519
"Collectivism is a caring, nurturing philosophy that relinquishes the pillar of selfish capitalism in exchange for a society that works for the whole, not the individual.",0.606046601
"Collectivism is a cloak and dagger method of maintaining a controlled, poor population for the benefit of a select few.",0.103798002
Collectivism is a communist strategy and we must reject it,0.03123503
"Collectivism is a facet of socialism, communism, etc., and removes individual value",0.901243435
Collectivism is a good thing when used properly,0.013421883
Collectivism is a good way of thinking. The group is always more important than an individual.,0.834508214
Collectivism is a good way to maintain consistency.,0.320214446
Collectivism is a great way to ensure that everyone is represented and cared for.,0.805089982
Collectivism is a harmful ideology that sets group members against each other.,0.999922064
Collectivism is a kind of communism in which some people cheat and benefit from other efforts,0.560740472
Collectivism is a natural way to protect and prosper a society,0.530447821
Collectivism is a positive concept.,0.005397122
Collectivism is a sense of belonging and achievement to a group. Responsibility is shared equally and the pride gained is a confidence boost.,0.772892012
Collectivism is a corruption-prone system that impoverishes the population for the benefit of a select few.,0.970541729
Collectivism is a kind of brainwashing that is no different from cult. Who decides what is best for the collective group and who says they are right?,0.761209718
Collectivism is a way to keep people in line and follow the group.,0.078962125
Collectivism is advantageous because it promotes cohesion and stakeholders tend to find common values and goals.,0.820484989
Collectivism is an important practice when it comes to placing the higher good at the heart of society.,0.791457078
Collectivism is bad and should not progress.,0.061536095
Collectivism is bad for society because individual efforts are discouraged,0.834296404
"Collectivism is better for people because you have a whole group of people working for an end result, rather than having to achieve it alone.",0.999811309
Collectivism is a boon for co-existence. People will work hand in hand to achieve their goal and to develop their country more rigorously and more quickly.,0.122073304
Collectivism contradicts the right of all people to self-determination.,0.955028819
Collectivism can easily be abused because the right of the individual is more important than the well-being of the collective,0.669004615
Collectivism is for the good of many at once.,0.728954415
Collectivism harms individual rights,0.897929833
"Collectivism harms people in general. While it supports the group, the members of the group are left to suffer.",0.693689171
Collectivism is helpful to society and should be allowed.,0.053598737
Collectivism is important because it can help reduce economic inequality.,0.887022949
Collectivism is in direct conflict with individualism and people's right to personal freedom.,0.987219937
Collectivism is in the interest of society as a whole and aims to protect the weak and disadvantaged,0.923669079
Collectivism is just a fancy word for communism.,0.000743971
"Collectivism is only an alternative name for a system that seeks to eliminate the mass of property in the name of a higher good, when in fact it is only a means of abusive control.",0.726669923
Collectivism is morally wrong and a form of slavery.,0.789961675
Collectivism is similar to communism and does not teach people to earn their privilege,0.271774812
Collectivism is necessary for people to help each other and persevere.,0.092448733
Collectivism is negative because people always have personal interests,0.439348097
Collectivism is not a good thing nowadays,0.00782059
Collectivism is not good because some people work harder or earn more than a group as a whole.,0.651906062
"Collectivism is pointless, it is not aimed at the whole, but at the loudest in a group.",0.574521076
Collectivism is positive insofar as it is based on sharing and living in community,0.41421366
Collectivism is biased and should not be acceptable,0.446163738
Collectivism is a society that works for the benefit of the masses and not for the benefit of the individual.,0.515208963
"Collectivism is the best way. It is a fundamental, inclusive way for everyone to get something, not just a few.",0.898945928
"Collectivism is the best way to do something, because the necessity of the whole always outweighs the necessity of the one",0.552352435
"Collectivism is the best way to achieve something, otherwise you spend too much time and energy looking after the minority.",0.865031057
Collectivism is the enemy of capitalism and punishes hard work.,0.902936218
"Collectivism is the interdependence that promotes worker unity, which in turn promotes high productive returns.",0.502041976
"Collectivism is the most principled form of governance, just government requires popular consent, and collectivism seeks to put the people above any particular interest or individual.",0.90462242
"Collectivism is a much-needed antidote to the increased focus on selfish individual needs, rather than doing what is best for society as a whole and fostering social cohesion.",0.851000119
Collectivism is the only way in which society can be fair and balanced towards those who need the most help.,0.778296335
"Collectivism is the tyranny of the majority, at least the most vocal majority. It is against everything a free society stands for. It is the enemy of freedom. Every voice must be heard, not just the loudest.",0.999515249
Collectivism is too generalized to be a valid course of action; it disregards the individual in a society.,0.965665474
Collectivism is unfair to the large population and should be stopped,0.465867344
Collectivism is unfair to those who work hard when everything is shared with those who do not work at all.,0.924580657
Collectivism is unhelpful because it runs counter to entrepreneurial spirit,0.69372251
Collectivism leads to a greater sense of community in which people take care of each other.,0.983253423
Collectivism leads to a stagnant culture in which new ideas are never formed and expressed,0.99977136
Collectivism leads to authoritarian rule and order imposed by the police state; people must be free for a political system to be just.,0.982910844
"Collectivism leads to democracy and saves people from complete anarchy. Without a collective good, individual freedom would lead to lawlessness and injustice.",0.665792244
Collectivism leads to unstable forms of government such as socialism or communism.,0.692062907
Collectivism let people know that there are more important things than themselves,0.401381227
"Collectivism levels the playing field, combats wealth hoarding, and the concern for all is the same society.",0.746380646
"Collectivism restricts individual freedom, autonomy and self-determination and ruins the opportunities for competition and innovation that result from self-motivated individuals.",0.992464942
Collectivism respects everyone and leaves no one behind,0.823608073
"Collectivism is lazy. Why work hard when others do it for you? Instead, we should promote individualism, where people are encouraged to innovate and work hard.",0.705385014
Collectivism motivates some people because they know that the other member of their group will take care of them.,0.834435526
Collectivism ensures that everyone is taken care of and that weak will is taken care of.,0.87523476
Collectivism can unite society and create common ground between different people.,0.935709522
Collectivism means that everyone gets a share of the end product and makes it fairer for all.,0.215091815
Collectivism means that everyone has equal access to facilities.,0.30146275
"Collectivism means that a group of people promotes positive value, cares about the individual, and ensures that everyone is valued and respected.",0.949108024
"Collectivism necessarily means restricting individual freedom, so it makes no sense to adopt it.",0.768231999
"Collectivism is opposed to the Declaration of Independence, which states that every human being has the right to life, freedom and the pursuit of happiness.",0.996995128
Collectivism prevents original thinking and discourages people from looking for their own idea,0.967394124
Collectivism prevents people from moving forward through hard work.,0.742828244
Collectivism promotes a communist society and often excludes certain members of society.,0.293213418
"Collectivism fosters a greater sense of community, in which people care about each other's well-being.",0.999238889
"Collectivism promotes common ground so that everyone can live in harmony, so we should accept it, not reject it.",0.959401306
Collectivism offers a common goal that everyone can work towards.,0.903243629
"Collectivism provides assurance that the greater good of a group is protected from the whims and needs of certain individuals, which can have a negative impact on the group.",0.136192561
Collectivism creates a better community and a society in which everyone is helped.,0.452885617
Collectivism offers equal opportunities for all and a safety net when things go wrong,0.728737328
Collectivism creates equal opportunities for all members of the group.,0.966630523
Collectivism offers no incentive for gainful employment and leads to a lazy society.,0.955161066
"Collectivism offers no incentive for people to work hard, because they have no chance of becoming rich.",0.976562387
Collectivism places the higher good above the right of the individual,0.023807386
"Collectivism reduces individuals ""productivity, and they have no incentive to do better.",0.925623988
Collectivism diminishes the value of each person and their unique perspective.,0.917191875
"Collectivism is based on the existence of a group that believes that it should be united in action and faith, but this existence of one group often leads to nativism and xenophobia by generating the other.",0.132548159
Collectivism deprives individuals of the right to defend their private interests and exercise their autonomy.,0.678525003
Collectivism requires too many individual compromises.,0.603820686
Collectivism stifles innovation and incentives to pursue personal goals,0.189086393
"Collectivism leads to individual suffering while others thrive, and it is not right that some are left behind.",0.25919086
"Collectivism rewards the lazy by giving them the fruits of the work of those who work hard, which in turn results in those who work hard ceasing to work hard and everyone being lazy.",0.789707023
Collectivism ruins growth because it promotes single-track thinking.,0.386997389
Collectivism in order to diminish the value of the word and the desire of each individual.,0.991909966
"Collectivism should be banned, because every human being is an individual and must be treated in this way.",0.866349206
Collectivism should be promoted so that the people in the team work better together,0.391856691
"Collectivism should be fought by focusing on the right of the group to the individual, something against the ability of people to make their own decisions.",0.795877763
"Collectivism should be fought, a people should have the right to take care of itself first.",0.932581661
"Collectivism should be fought, because in something like this everyone is looking out for each other and is therefore in some way responsible for it.",0.948716902
Collectivism should be fought because it allows those in power to override the right of the individual,0.996576376
Collectivism should be supported because there are small groups that are in the minority and must be given preferential treatment because they are swallowed up by the public if they are not guarded.,0.895778464
"Collectivism should be used in such a way that all people are equal and valuable, prosperity would be more evenly distributed, and we would all fight for each other with hatred and struggle.",0.841479468
"Collectivism should not be fought, but should lead to a greater sense of group identity, while protecting the weaker in society.",0.983537583
"Collectivism should not be fought, because collective groupthink can be more powerful than the individual alone.",0.000791673
Collectivism should not be fought because a society like this is generally more stable,0.20967292
"Collectivism simplifies life, making it more predictable and cohesive.",0.872694767
"Collectivism solidifies individuality, which puts us in a situation like the 1984 book.",0.071278167
Collectivism stifles individual entrepreneurship and the emergence of new ideas.,0.897096009
Collectivism stops creativity and individual thinking,0.745203048
Collectivism prevents people from improving themselves.,0.715146071
Collectivism keeps people from thinking for themselves.,0.66029396
"Collectivism deprives the individual of the fundamental right to prioritize his or her individual needs, generating resentment toward the members of the larger community who benefit from it.",0.966979074
Collectivism takes a shine off any individuality.,0.097786306
Collectivism deprives people of the ability to make their own way in life.,0.581512908
Collectivism deprives one of the freedom to make one's own choice.,0.865324835
Collectivism cares for all members of society equally,0.921359232
Collectivism takes care of the need of an entire group against only one person.,0.438577509
"Collectivism cares for everyone, not just those at the top",0.99334118
Collectivism diverts the focus from the individual in a way that each of us is unique. Supporting collectivism means that the individual should remain subordinate to society.,0.469339955
Collectivism all too often causes the individual to suffer unnecessarily,0.301941725
Collectivism treats everyone equally,0.950567923
Collectivism uses the best of many sources,0.789717762
"Collectivism violates human rights, violation of human rights is immoral and sinful",0.002763922
Collectivism creates a hive that is dangerous.,0.489736166
Collectivism will ultimately fail because it runs counter to basic self-preservation.,0.871210812
Collectivism works against entrepreneurship and discourages individuals.,0.98277285
Collectivism works for the common good. Everyone should be selfish.,0.248811995
Collectivism works for the whole of society and not for the individual,0.800975041
Collectivism would be good in a situation where it has to be a group decision.,0.645573959
Collectivism would discourage disputes and bring more peace.,0.68808335
"Collectivism would not allow people to make their own decisions, it would always be a group decision.",0.044934541
Collectivism would not work in our society,0.008176064
Collectivist culture cares more about society than individualistic culture.,0.998489583
"Collectivist laws prevent the massive prosperity and political divide we see in our modern society, which threatens not only our social stability, but also our long-term economic well-being.",0.981824749
Collectivist practice maximizes the general well-being of the population by ensuring that all people are cared for at least to the extent that they can lead healthy and productive lives.,0.922610925
Collectivist society is generally more stable because everyone is looking for the group.,0.437860748
"As a collective, a group of people can accomplish much more than just going it alone.",0.199718593
"The collectivization of resources often leads to an inefficient allocation of these resources, and a central authority is often unable to understand which region and which people need these resources most or could use them most efficiently.",0.960797936
Collectivism is unfair to the world and irrational,0.070312436
"College gets more expensive every year, so students should get plenty of help they need",0.831173997
"College is no longer affordable. An education can cost more than a home. Paying off a student loan allows graduates to flourish, buy a house and a car, and support the economy.",0.538632392
College is preferable to vocational training.,0.000907678
"College is not for everyone, so you go to a place that gives you the skills for the chosen profession",0.288406733
"College is supposed to teach people something, and students who go into a safe space when they disagree with the subject do not help them learn anything.",0.002877388
"Colleges are no longer relevant today. Going to college does not guarantee you a good and secure job. Subsidising student loans only contributes to a state budget deficit, while this money can be used for other good causes.",0.057405325
Commitment and stability are important in children's lives and marriage offers this quality,0.838067945
"The commodification of women's bodies, especially the poor woman who tends to be surrogate mothers, is dehumanizing.",0.876193072
Businesses and governments cannot afford the luxury of leaving daddy at home.,0.510552421
"Businesses and individuals often even spend a year developing services and products, they have also spent a lot of their own money and need the chance to recoup that.",0.814790566
Companies are not just run by executives; everyone in the company should benefit from the productivity of their company. Restricting executive compensation and redistributions would have a big impact.,0.788854762
"Companies pay their top executives a thousand times more than their employees, claiming that they cannot afford to pay more than the minimum wage to the people who do most of the work for the company.",0.905960019
"Companies spend too much money to apply for patents, and that money could be spent to develop better products.",0.135405006
Companies have the right to advertise and try to do business.,0.851632244
Companies have the right to give their executives an extra incentive to work,0.112676265
"Companies invest billions in research; if there is no law, it would prevent companies from doing research in the first place.",0.901219456
"If another company is able to use such an idea without prior investment, then it is deeply unfair to the company that developed the idea.",0.930375356
Companies must be able to end an employment relationship at a practical age,0.050420888
Companies must be able to offer every salary they need to ensure they get the talent they need.,0.838451578
