argument,score
"If someone is able to do their job, it should be their decision on when to retire, not the decision of some bureaucrat.",0.588067825
a long a the child is not forced and wants to act then they should be allowed,0.671771456
"As long as the child really wants this and is adequately supervised, they should be able to act.",0.984687809
"For as long as the child follows a standardized curriculum, homeschooling can be a rewarding experience for some people.",0.74224226
"a long a the operation ha a specific goal, a realistic chance of success and parental consent there is no valid reason for a ban",0.607495984
"As long as there is no forced marriage and these people absolutely love each other and the others they are married to do not influence them, why can't we make it legal?",0.838162966
"as long as there is adequate protection for child actors, there is no reason why they should not be able to appear on screen",0.303228417
"As long as they are properly informed, someone should be allowed to sell organs for a fee if he chooses to do so.",0.881884897
a long a they have parental permission should the child be allowed to improve their physical appearance,0.469596447
"As long as they use a licensed plastic surgeon, people should be able to do what they want with their bodies.",0.759432739
"As long as those who enter into this relationship are of age, we should legalize polygamy. This lifestyle does not harm anyone and does not harm society. People should be free to love whoever they want.",0.637788908
"As long as we do not overfish, there are no negative consequences for whaling and no reason to ban it.",0.295059958
"We have long had deep-rooted racial or sexuality-based prejudice and violence, and we continue to need a safe place.",0.796633807
"If a whale is not threatened with extinction, people should be allowed to use the whale for their oil, their blubber, etc. for food supplements, etc.",0.852120174
"If a whale is not on the verge of extinction, people should be allowed to make a living in this way if they so wish.",0.929006843
"Since many people's views do not coincide with those of the two major parties, we cannot say that the current system is truly representative.",0.908382234
"A mother is forced out of the house and back to work, instead of being allowed to remain in the role of a carer, we should not subsidise her stay at home because she displaces the mother.",0.046072912
"a our national debt continues to climb, I think it is important that we introduce an austerity regime, we have to cut spending on everything and we have to fix this massive debt.",0.484462257
"As our population grows, we must have a place to live, and urbanization will of course take place, and we need more space for people.",0.747070561
Compulsory retirement ensures that the profession is filled with people who are at the peak of their cognitive and physical capabilities.,0.9889158
Compulsory retirement forces people living longer to marginalise those who can still make a positive contribution to the workforce,0.818051175
"Since people are born randomly into the world, and for the most part do not choose the community into which they are born, they should not be obliged to serve the collective because they have not consented to its existence.",0.990071366
"As people have children later and later, compulsory pensions prevent people from providing for their families and dependents.",0.999600704
"People are getting older, their reaction and thought processes are slowing down, their eyesight and hearing are deteriorating, and a mandatory retirement age reduces the dignity of being discharged because they are no longer fulfilling their duty.",0.740718754
"When people live longer and have variable health, the idea that everyone must retire at a set age is archaic, and therefore we should end compulsory retirement.",0.994437657
"As the quality of life improves and average life expectancy increases, compulsory retirement seems more and more out of step with modern human experience.",0.095688151
"A society and a change in values, marriage is no longer popular as it once was and the divorce rate continues to rise.",0.812993459
"a song in which another nation has nuclear weapons, we must not give up our own",0.003469933
"As the world's population continues to grow, urbanization is needed to ensure that there are enough housing and employment opportunities for society to function.",0.889964389
"As the only actor that can legitimately exercise the use of force, the state has a duty of reparation to the victims and their families to seek retribution against criminals, including the use of the death penalty.",0.356269061
"a There are many genders today who do not use gender-neutral language, excluding many more people than in the past.",0.944232735
a) They constitute a threat to freedom of speech.,0.002182712
"a They provide a ghetto-like existence for minorities and divide society. They prevent society from growing and developing tolerance and respect for each individual, which promotes prejudice.",0.507778832
"a we are all part of our society and that we must support our country and our elected government, and if the government has debts or deficits, we are obliged to help and support it.",0.002920841
a We have overcome the threat of closing the Guantanmo Bay detention center.,0.013483463
"Assisted suicide can be abused by those who want to profit from the exploitation of a sick or sick relative, and should therefore not be allowed.",0.827898387
"There were no assault rifles, machine guns and the like when the bill was written.",0.826623463
Assisted suicide is basically murder,0.9590605
Assisted suicide allows a person to die with dignity instead of going through a painful and dehumanizing process.,0.980995321
Assisted suicide enables a sick person to understand what is being done to end their pain when quality of life cannot be guaranteed.,0.461374177
Assisted suicide makes it possible to end pain and suffering in the final stage and should be allowed to continue.,0.985057693
"Assisted suicide enables people who have a terrible state of health to die with dignity. If assisted suicide is a crime, they may have to live in fear of death for many more years.",0.832722363
Assisted dying allows terminally ill people to die with dignity and should not be criminalised,0.910193791
Euthanasia allows the terminally ill to decide for themselves when they die and to do so with dignity; it allows people to choose not to live in a state of pain and misery and to choose to continue with human intervention.,0.910986985
Assisted suicide and the right to live with dignity are a human right and should be legalised everywhere. It is a human right to choose not to suffer from an incurable disease.,0.989598238
"Assisted suicide blurs too many boundaries with murder, even if the patient agrees",0.985302607
"Assisted suicide can sometimes be the only way to end the unbearable suffering of some people with incurable, debilitating diseases such as motor neurone disease.",0.971487068
"Assisted suicide could also be called murder, as it enables the death of another person and should therefore constitute a criminal offence.",0.928372082
Assisted suicide could be abused by people who want their weaker partner to die. People could be encouraged to take their own life before they really want to.,0.964269505
Assisted suicide could be exploited by people who want to profit from the legacy of terminally ill people who are unable to stop them.,0.018801695
Assisted suicide gives people control over their lives in terrible circumstances and allows them dignity in death instead of living in terrible conditions for many years.,0.917808885
Assisted suicide is in direct contradiction to the doctor's oath not to cause harm. Suicide is harm. There is no supervision when the patient is administered the drug. They are prescribed and the patient alone faces death.,0.856259795
Assisted suicide greatly reduces pain and suffering and gives people dignity in dying and should be legalised there.,0.942393455
Euthanasia helps suffering patients to end their misery without violence.,0.962553083
Assisted dying helps terminally ill people to end their suffering,0.370986771
Assisted suicide helps people suffering from constant pain due to an incurable disease,0.914326279
Assisted suicide helps those who are in pain due to a devastating illness to end their own lives on their own.,0.048588113
"Assisted suicide is the murder of a person, which is illegal and should be treated as such.",0.886791415
"Assisted suicide is a blessing and not a crime. A person who wishes to be assisted in this is in great pain or has no possibility of being cured, and should give the suffering the chance to end.",0.974558405
"Assisted suicide is a compassionate act intended to end suffering in the event of incurable diseases, when the law must protect people in these cases within a properly regulated framework and strict safeguards.",0.328350473
Assisted suicide is a compassionate way to help people end their lives without violence.,0.724124374
Assisted suicide is a crime and those involved should be sent to prison.,0.030818164
Assisted suicide is a criminal offence involving the deliberate death of a person.,0.98891183
Assisted suicide is a criminal offence and a form of assisted murder,0.980964838
Assisted suicide is a form of murder and should be a criminal offence,0.766228368
Assisted suicide is a form of murder and should be treated as a crime,0.887853215
Assisted suicide is a form of murder and should never be allowed.,0.624074762
Assisted suicide is a form of premeditated murder and should be prosecuted.,0.768938904
Euthanasia is a great help for people suffering from terminal diseases who are on their deathbed,0.836227452
Assisted suicide is a human right and would spare the terminally ill person pain.,0.117921966
"Assisted suicide is a humane and caring way to help a person whose life is too difficult to be lived properly in any way, so it should not be criminalised.",0.796433863
"Assisted suicide is a humane way of ending a life, as we do with animals in pain, and should not be a criminal offence.",0.962466785
Euthanasia is much better than allowing a person to suffer for the rest of his or her life.,0.753811569
Assisted suicide is a personal decision about how a person wants to live their life and should therefore be constitutionally permissible.,0.368240792
Assisted suicide is a personal decision and the government should not interfere in people's personal decisions.,0.846561972
Assisted suicide is beneficial for sufferers with no hope of survival,0.009516071
Assisted suicide is once again the natural rule of life and should be a criminal offence.,0.003213645
Assisted suicide contradicts the oath taken by all doctors.,0.176754273
"Assisted suicide is an act of compassion carried out by those who care for terminally ill people in extreme pain and help someone with their last wish, simply a form of service.",0.923709223
Assisted suicide is an act of helping another person and helping them to take the life they want to end.,2.92e-06
Assisted suicide is another form of manslaughter,0.873110698
Assisted suicide is a different type of murder.,0.927850564
"Assisted suicide is at best unlawful killing, at worst murder, and must be made a criminal offence in order to protect the right to life.",0.774842004
Assisted suicide is at the discretion of the individual who suffers from an incurable disease and should have the right to end his or her life if he or she deems it appropriate.,0.788096189
Assisted suicide is tantamount to murder and should be treated as such.,0.839468189
"Assisted suicide is tantamount to murder, and the end of one's life is determined by God and should be a criminal offence.",0.001002403
"Assisted suicide is essentially murder and should be punishable by a so-called ""death penalty.""",0.50453223
Euthanasia is heartless and inhumane,0.618196611
Assisted dying is immoral and a crime,0.427542478
"Assisted suicide is just another form of murder. Murder is illegal, so assisted suicide must be illegal.",0.610612107
Euthanasia is just another word for murder.,0.593980107
Assisted suicide is merely the aid to kill a person that appears to be a crime.,0.478294467
Assisted suicide is like assisted murder,0.41356935
Assisted suicide is murder under a different name and should be punished accordingly.,0.760086555
"Assisted suicide is killing under another name, it is far too open to abuse by people with a personal interest, as it is often impossible to accurately interpret the individual's intention to ""assist.""",0.619671926
Assisted suicide kills someone even if it is at their request,0.903378895
Assisted suicide is murder and murder is a criminal offence.,0.742472898
Assisted suicide is murder and should be banned.,0.557232438
"Assisted suicide is murder and should be punishable by a so-called ""death penalty.""",0.895799494
Assisted suicide is murder and therefore illegal,0.034990809
Assisted suicide is murder by another name and should remain illegal,0.556486269
Assisted suicide is murder of another and should be considered a criminal offence.,0.976923249
Assisted suicide is murder; the doctor hands over the weapon to the person with the sole purpose of death.,0.745089204
Euthanasia is necessary in our modern world full of people dealing with pain and suffering,0.271189971
"Assisted suicide is not only immoral, it is also a form of murder and should be punishable by law.",0.73176145
Assisted suicide is nothing other than murder. It gives a person the opportunity to legally kill another person. This should be prevented. No person should be allowed to cause the death of another person.,0.653499325
Assisted suicide is nothing less than murder and should be a criminal offence.,0.9558342
"Assisted suicide is really just another word for murder or manslaughter,",0.201023726
"Assisted suicide is sometimes the only solution for some people, we should not abolish it.",0.167512099
Assisted suicide is still one person who essentially kills another,0.743932031
"Assisted suicide is still suicide, which is immoral in any form.",0.810805249
"Assisted suicide is still suicide, which is immoral.",0.044639354
"Assisted suicide is still suicide, which is wrong in any form.",0.716335052
"Assisted suicide is still killing someone else, regardless of how it is carried out, that cannot be a grey area, killing is wrong, and the law must take a stand on this in order to avoid worse.",0.901677462
"Assisted suicide is the kindest thing to do to help a dying patient, to prevent the last hour or day of his life from being torture, and it should not be a criminal offence.",0.857058324
Assisted suicide is the liberation from unbearable pain for people with incurable illness or zero quality of life; it is an act of selfless benevolence that should be protected by law.,0.953554523
Assisted suicide is the same as murder and should therefore be illegal.,0.499886445
"Assisted suicide is too dangerous, because if someone is weak and weak, a manipulative person could encourage them to kill themselves if they do not really want to.",0.608414533
Assisted suicide is too risky if someone is not in the right frame of mind to decide whether they really want to die.,0.640420994
"Assisted suicide is unethical, how do we know that the person assisting suicide has nothing to gain from the death of the other person?",0.733468304
Assisted suicide is wrong and we should try to help the person heal rather than kill themselves,0.21659739
"Euthanasia is wrong, no one should take someone's life, there is always hope for the future",0.439190015
Assisted suicide can be a good option for patients who are otherwise terminally ill and suffering unnecessarily.,0.279250241
"Assisted suicide must be allowed, and if a terminally ill person wants to end their life, they should have the peace of mind to be able to do so with the help of a professional doctor, rather than potentially aggravating it on their own.",0.23264446
"Assisted suicide must exist when people suffer from an illness, and after thorough verification that it is true, otherwise it must be punished.",0.029343198
Euthanasia only creates problems for the family of the deceased,0.012870458
Euthanasia should be a choice for those who are unable to do so.,0.94904882
"Assisted suicide should be a criminal offence, because killing a person in any situation is not right.",0.397791029
"Euthanasia is a way for people who are in pain to end their lives and end their suffering, and they should be allowed to die with dignity and decide when it is right for them.",0.831823317
"Assisted suicide should not be a criminal offence if people with chronic health conditions are unable to commit suicide on their own, but should have the right to decide for themselves whether they continue to suffer.",0.957384674
Assisted suicide should be a crime to prevent greedy individuals from killing their family members in order to gain access to their money and property.,0.83065555
"Assisted suicide should be a criminal offence. If the person cannot make his or her own decision and action, then it would be impossible to know whether the person helping him or her did not simply kill him or her.",0.870115676
Assisted suicide should be a criminal offence and is another form of murder,0.783755172
"Assisted suicide should be a criminal offence, as it essentially contributes to killing someone, and manslaughter should be considered.",0.963006335
"Assisted suicide should be a criminal offence, it is just another form of murder.",0.310120727
"Assisted suicide should be a criminal offence, as it is not a human right to play God and can lead to murder rather than assisted suicide.",0.591338757
"Assisted suicide should be a criminal offence, because after death no one knows what actually happened, whether it was assisted suicide or murder.",0.227837669
Assisted suicide should be a criminal offence because it is against the law of God,0.017462853
Assisted suicide should be a criminal offence because it affects a person's life,0.033410197
Assisted suicide should be a criminal offence because it causes the death of a person as much as it causes the death of a criminal.,0.101734787
"Assisted suicide should be a criminal offence because it could be a homicide, how would you be able to prove that",0.825354434
Assisted suicide should be a criminal offence because it could force some doctors to perform this act without their consent.,0.632028756
Assisted suicide should be a criminal offence because it does not allow a person to die a natural death.,0.235178987
Assisted suicide should be a criminal offence because it is morally wrong,0.504427612
Assisted suicide should be a criminal offence because it is still considered a homicide even if the person chooses to commit it.,0.514688819
"Assisted suicide should be a criminal offence, because it involves killing a living person as well as killing with poison or a weapon.",0.782970061
"Assisted suicide should be a criminal offence, because it would be very easy to murder a vulnerable relative in order to receive an inheritance.",0.977826311
"Assisted suicide should be a criminal offence because killing is wrong, whether intentional or not.",0.442308567
Assisted suicide should be a criminal offence because killing someone is wrong even if it is what you want them to do,0.28509625
"Assisted suicide should be a criminal offence, because no one has the right to take another person's life or help them.",0.743990079
"Assisted suicide should be a criminal offence because pain makes people do something extreme, but it should not include death.",0.078637071
Assisted suicide should be a criminal offence because people should not be able to help others murder,0.184191311
Assisted suicide should be a criminal offence because it is murder,0.760322185
Assisted suicide should be a criminal offence because the person essentially kills the other person.,0.922522936
Assisted suicide should be a criminal offence because we cannot kill people just because they have a problem.,0.806567538
"Assisted suicide should be a criminal offence, because what if the person concerned was only in a poor emotional state that could be cured with professional health?",0.503278408
Assisted suicide should be a criminal offence for Eutanasya,1.37e-05
Assisted suicide should be a criminal offence under God's law.,0.031993002
Assisted suicide should be a criminal offence because any type of suicide (whether assisted or not) is immoral.,8.4e-05
Assisted suicide should be a criminal offence because at the end of the day someone is dead and you were involved.,0.075834805
"Assisted suicide should be a criminal offence, because death is death, at the end of the day someone is dead and you have got your hands on them.",0.852019747
Assisted suicide should be a criminal offence simply because it is a different name for murder,0.126000616
Assisted suicide should be a criminal offence because no one should die by suicide,0.300301892
Assisted suicide should be a form of murder or premeditated murder. People should not die by suicide in a natural way.,0.135927582
Assisted suicide should be permitted because it enables people with incurable diseases to die with dignity before suffering a long and painful death.,0.884827697
Assisted suicide should be allowed for people who are terminally ill,0.807443245
Assisted suicide should be allowed when a person can no longer bear the pain of traditional medical treatment. It should be a person's right to die.,0.487372017
"Assisted suicide should be allowed under certain circumstances, such as when a person suffers from a serious illness.",0.91137961
SUICIDE SHOULD BE ALLOWED TO PEOPLE THAT PEOPLE MUST HAVE A LONG TO LONG,0.057152469
Assisted suicide should be an individual's choice and personal freedom,0.867036991
"Assisted suicide should be made a criminal offence, since no human being has the right to determine whether another human being is alive or not.",0.658469608
Assisted suicide should be illegal and it is never morally right to help take a life.,0.832719054
"Assisted suicide should be legal everywhere, because it is wrong to prolong suffering when there is an easy way to end it.",0.699717186
"Assisted suicide should be legalised, so that many people suffer from a debilitating and painful disease, and it should be advised and supported to make an informed decision.",0.999644904
"Assisted suicide should be legalised so that those who have an incurable illness or incurable pain can make an informed decision to end their lives with dignity, surrounded by people who love them.",0.96139306
Assisted suicide should not be considered a criminal offence because a person could really suffer and be in pain and to make them suffer is heartless and inhumane.,0.077651769
"Assisted suicide should not be a crime, as the perpetrator merely obeys the wish of another.",0.633038168
"Assisted suicide should not be a crime. If someone suffers daily from something from which they will die anyway, they should be allowed to die on their own.",0.804741083
"Assisted suicide should not be a criminal defense, because in some cases, like people with terminal cancer, they are shown mercy and saved from suffering.",0.890292747
"Assisted suicide should not be a criminal offence, a person should not be expected to live in a waking coma and need help to make his own decision to die a reality.",0.922247077
"Assisted suicide should not be a criminal offence, and people without a quality of life should not have to suffer indefinitely, and their trusted helper should not be a criminal if he helps them.",0.368325613
"Assisted suicide should not be a criminal offence, because a person should be able to decide for himself how and when he wants to die.",0.997987015
"Assisted suicide should not be a criminal offence, because if someone does not want to live, they should not be forced to do so.",0.703590319
Assisted suicide should not be a criminal offence because it helps to alleviate the suffering of those who will never recover from their illness or injury.,0.559951105
Assisted suicide should not be a criminal offence because it is sometimes the only way a person suffering from a debilitating condition such as motor neurone disease can end their life.,0.936819564
Assisted suicide should not be a criminal offence because the individual still commits suicide.,0.008770924
Assisted suicide should not be a crime if the patient asks for it to be done to him.,0.035492221
"Assisted suicide should not be a criminal offence, because when a loved one is terminally ill, it offers them the opportunity to die with dignity instead of suffering until they die a natural death.",0.934374219
"Assisted suicide should not be a criminal offence, everyone should have the right to end their life peacefully as soon as they reach a point where they are no better off.",0.929201449
"Assisted suicide should not be a criminal offence, because if someone does not want to live, why should they be forced to?",0.87423414
"Assisted suicide should not be a criminal offence, because if someone is in enough pain and sensible enough to make a decision, they should have that choice.",0.967626486
Assisted suicide should not be a criminal offence because it helps people who are in constant pain due to an incurable disease.,0.910986985
Assisted suicide should not be a criminal offence because it would help people who are in terrible pain due to an incurable disease.,0.947302639
"Assisted suicide should not be a criminal offence, because if a person becomes seriously ill, they should not have to continue to suffer.",0.681631502
"Assisted suicide should not be a criminal offence, because when you become so ill and have no hope, you should be able to end the pain.",0.955823959
