argument,score
"Assisted suicide should not be a criminal offence, as it should be a personal decision about what a person wants for themselves. It could spare a person with no quality of life months or years of pain.",0.746307788
"Assisted suicide should not be a crime as long as the person consents and protects them from suffering, like someone with terminal cancer.",0.586541057
Assisted suicide must not be a precious life,0.597581059
Assisted suicide should not be an option just because people are in pain and there are other ways to help,0.04445042
Assisted suicide should not be a criminal offence because doctors do it when a person becomes too ill,0.00098786
"Assisted suicide should not be a criminal offence, because doctors use it as an option for extremely ill people so that they do not have to suffer.",0.776272001
"Assisted suicide should not be a criminal offence, because every person should have the right to be assisted by someone in passing when they discover that they no longer want to live.",0.931319647
Assisted suicide should not be a criminal offence because it allows the patient to control his or her final decision.,0.032528665
"Assisted suicide should not be a criminal offence, as it is used as a last resort for very sick people to end their suffering.",0.851317895
"Assisted suicide should not be a criminal offence, because sometimes the person suffers such pain or has no life if he is just lying in bed.",0.16156537
"Assisted suicide should not be a crime if they suffer from an incurable disease, they will die anyway",0.246954992
Assisted suicide is sometimes the only thing that stops the suffering.,0.086816545
Assisted suicide is usually a terminally ill patient who is tired of struggle and agony.,0.978536406
Assisted suicide would alleviate much of the suffering of people with an incurable disease that is too much to bear.,0.070037284
Assisted suicide would spare the terminally ill pain and suffering.,0.003762157
Euthanasia is painful and an act of mercy,0.583325582
Assisted suicide can end the pain of those suffering from an incurable disease.,0.988391428
"Assisted suicide should not be a criminal offence, as some people rationally decide that their life is of such poor quality that death would be better, and this should be their right.",0.130816208
Assisted suicide for medical reasons should not be considered a criminal offence because the person makes a reasonable judgment based on the suffering of others.,0.96552661
Helping someone to take their own life is still murder and must be punished accordingly by law.,0.612334004
"Helping someone commit suicide is tantamount to murder, and that person has a moral obligation to report that person's intention to the authorities.",0.502389982
Assisted suicide is the same as assisted suicide.,0.555954065
"Assisted suicide should be a criminal offence, as should conspiracy to commit murder.",0.843049172
Assisted suicide is still assisted murder,0.309081179
"Assisted suicide is assisted suicide and should be treated as such; the intention of the victim does not matter, murder is murder.",0.913254946
Assisted suicide enables people with a painful and incurable disease to end their lives in order to end the pain and suffering that would last until the end of their lives.,0.277987293
"At a certain age, it becomes dangerous for an older person to do a job.",0.295726444
"At any given time, there are at least three former child stars who have broken down very publicly.",0.136265958
"For children at least, they should be treated with the best possible care, as they cannot make a decision themselves.",0.000289355
"In many physical activities, someone who has reached a certain age can become a burden, and a mandatory retirement age is a good compensatory tactic.",0.832051011
"At this age, people should not decide whether or not they need cosmetic surgery.",0.323922915
"At the time of marriage, people undertake to take care of each other, and if, in the circumstances, the father is better able to take care of the matter at home, what is the purpose of questioning this subsidy?",0.02168103
"At the time of the bill, the legal capacity to carry the arm was different from today. Back then, it was the principle for a person to defend himself against a repressive government. Today, it is for criminals.",0.013450059
"At this time, many people are dying because they are not receiving organ transplants, and organ trafficking would encourage people to be more willing to have their organs transplanted to save others.",0.573818262
Going to college is a decision; why subsidize someone for that decision?,0.179022025
Attracting the best talent means that companies must offer the best executive compensation package they can afford for the company's future profitability.,0.856764584
Strict measures are needed to bring the national debt under control.,0.986344298
Austerity is the only way to reduce public debt.,0.930064009
Austerity hits the poor and disabled harder than the rich,0.227718236
"Austerity hits the poorest in society hardest, and the rich are not feeling the effects",0.789462225
"Austerity arguments are usually ideological arguments in disguise. We can't afford it, it's usually code, because we don't want to pay for it.",0.088264512
Austerity can help restructure a country's debt.,0.974823292
Austerity could end up hitting the poor hardest when they are already struggling.,0.948117012
Austerity in times of financial instability ultimately harms people who rely on welfare programs,0.833105606
Austerity measures are pushing the poorest section of the population into even greater poverty.,0.900364902
Austerity has the biggest impact on those who can least afford it,0.915060979
"Austerity, by and large, has been a dead loser in politics",0.001665457
Fiscal austerity usually results in spending cuts for those sectors of society that need it most.,0.975990982
Austerity is a personal choice and should not be enforced,0.009423518
"Austerity measures are counterproductive, as public expenditure is curtailed, with repercussions for the economy and the wider economy.",0.46600402
Austerity is incompatible with the 21st century,0.000944897
Austerity is necessary to save money in times of financial instability,0.962580825
Austerity is necessary because it prevents the country from having to borrow a lot of money.,0.945548974
Austerity is the best way to get the economy back on track,0.985130235
Austerity makes time harder for everyone.,5.4e-05
"Austerity hurts businesses, which need a free-spending culture to survive.",0.971391423
"Austerity stifles economic development and makes the economy worse, not better",0.921092698
Austerity measures will help to reduce public debt,0.997825635
Austerity measures will increase the number of people living in poverty.,0.984734907
"When welfare benefits are cut off from the poor, austerity usually engages the poor, leading to child poverty and people having to use food banks.",0.967980769
Austerity affects only the poorest in society and is not felt by the richest,0.766608941
Austerity only hurts the economy more than we need to invest to grow,0.991360855
Austerity only leads to a larger black market.,0.002379828
Austerity only leads to an economic contraction that jeopardizes the chance of deleveraging.,0.999409763
Austerity only stifles the economy and makes the situation worse over a longer period.,0.925531656
Austerity is needed to reduce the budget deficit.,0.995184516
"Austerity can lead to lower growth and lower tax revenues, especially in times of recession.",0.981197475
Austerity harms the poorest,0.985393367
Austerity improves the long-term economic performance of the economy.,0.996995702
"Austerity offers a tangible opportunity for the government to channel money where it is most needed, while ""cutting the fat.""",0.938064511
"Austerity only affects those at the lower socio-economic end of society and worsens their situation. Those who are the cause of the need for austerity, the rich, remain unaffected by such policies.",0.889456235
The austerity regime is a valuable option for the government.,0.000909196
Austerity measures can greatly reduce economic growth.,0.788503497
Austerity program may help city restructure,0.023007669
Austerity regime can help pay off debt,0.95076761
"The austerity regime has been successfully applied in many countries for a limited period of time, allowing the economy to recover.",0.958207655
Austerity is a bad option even when the country is facing recession; only high levels of economic activity and spending can revive economic activity.,0.836679601
Austerity is important to sustain vital government spending only when it lacks economic growth; it helps to reduce pointless spending and revive the economy.,0.849566224
The austerity regime is necessary to solve financial problems in a country when all other ways of deleveraging have not worked.,0.971083968
Austerity is not a real solution. It only undermines economic growth. It is spending that makes the economy grow.,0.558206163
"Austerity is the best option when the government has spent too much money on troubled projects. Borrowing money leads the country into enormous debt, austerity is the right thing to do",0.828303796
Austerity is unfair to the poor and unhealthy,0.313906998
"Austerity is wrong and only responsible, the government should deal with it, not the whole EU.",7.64e-06
"Austerity puts too much pressure on the economy. Austerity measures bring the government into recession, as economic activity falls much more sharply.",0.911736543
"The austerity regime should implement too much of the country's debt, which must be significantly reduced; public spending is wasteful; and cuts must be made to make service and spending more efficient.",0.305127908
"Austerity measures should not be introduced, as this will have a negative impact on services on which vulnerable people depend.",0.930012202
Austerity forces responsible government and spending,0.726955277
Austerity increases pressure on taxpayers,0.707045361
"The austerity regime would shatter the British economy, we need people spending on British goods to help our industry survive the turbulence of Brexit.",0.776371043
Austerity would hurt many with tax hikes,0.776371043
Austerity measures are bad for the economy and contribute to unemployment.,0.489728417
Austerity harms the democratic process,0.750402399
Austerity is harmful to a free society.,0.590812726
Austerity is not conducive to democracy,3.81e-05
Austerity is the best way to deal with public debt.,0.974293099
"The austerity regime is too restrictive, too many are cutting back and not benefiting the citizens of the united state.",0.347852044
"The austerity regime is unfair to the poor, because they are the ones hardest hit by government spending cuts.",0.999951891
Austerity measures are useful to the government.,0.000141065
Austerity measures are useful for underdeveloped areas.,0.415141311
Austerity can help in some situations,0.000945807
Austerity May Cause Widespread Unemployment,0.93840653
"Austerity can help soften the blow of a financial crisis and, in theory, ensure that money is spent where it is most needed in society.",0.555817499
"Austerity can raise income tax, reduce economic growth",0.615335297
The austerity regime is hitting the poorest in society disproportionately hard.,0.998652514
"Austerity does not work, because it reduces the number of jobs available, saving money and creating a vicious cycle of lending; they have to spend money to make money.",0.848846458
Austerity measures ensure that sufficient public funds are available and that they are used correctly,0.591308083
Austerity prolongs the recession and exacerbates people's plight.,0.951213303
"The austerity regime has hit the poor and dependent section of society disproportionately hard, and they are the ones least able to withstand such spending cuts.",0.513101325
The austerity regime is harming ordinary people by reducing support for schools and health care.,0.850100018
The austerity regime makes it almost impossible to stimulate the economy.,0.587132727
"The austerity regime may spare the government a few bucks, but always at the expense of ordinary and vulnerable citizens.",0.700696263
Austerity measures must be taken to reduce budget deficit and debt crisis,0.89475989
The austerity regime harms only those at the bottom of society and does nothing to combat the corruption and greed that have prompted the government to consider such a measure.,0.68636073
Austerity offers the government a way to close the fiscal deficit and save the country from economic collapse,0.999071894
Austerity cuts government spending and helps reduce the deficit,0.902649856
"The austerity regime is taking money away from the most vulnerable in our population, children, the elderly and veterans.",0.965409586
"Austerity measures tend to increase unemployment, government spending cuts lead to cuts in workers",0.446682834
Austerity should not be imposed because it is a personal decision,0.00290422
"Austerity will only exacerbate the financial crisis, and we need government spending to stimulate the economy.",0.991663561
Austerity will reduce the deficit and make the country better off in the long run.,0.933974518
Austerity measures would help save money in the long run.,0.904676608
"The automated car will displace many people who work today, and many people will need to be retrained for other jobs (if they exist).",0.884615962
"Autonomous cars have already killed one person, we cannot leave the road that is being used as a test room and we have more fatalities.",0.454704111
"Autonomous cars are safer because they do not fall asleep, do not drink or drive, and their reaction time is faster and more accurate than that of a human being.",0.999617304
"Autonomous cars are not at all reliable, and any kind of failure or hacking could lead to the deaths of many people who could do nothing to save their lives.",0.729127402
The development of autonomous cars must continue so that we get to the point where we have a reckless driver on the road.,0.821563921
"The development of autonomous cars should be continued in order to find safe transport for the masses, fuelled by renewable energies.",0.478241041
"The development of autonomous cars should stop because it will never work, because there are too many people in the world who are already causing accidents and congestion.",0.026642536
Autonomous car is a necessary means of transport,1.21e-05
Autonomous cars are the future of road transport and can help people drive safer and even relax.,0.71086081
"In the future, the autonomous car could be a safe means of transport without human error.",0.998271973
Autonomous cars allow those who cannot drive to get to the necessary visits without having to rely on others.,0.9708977
"Autonomous cars allow people with disabilities who are impeding driving to go to appointments, shopping and social events and not to live in isolation from others.",0.763834881
"Autonomous cars are a danger to everyone on the road, they cannot react in the same way as a human driver.",0.752318036
"Autonomous cars are a danger to society and should not be developed. Cars cannot be programmed to make judgments, and are therefore dangerous.",0.856651012
Autonomous cars are a danger to the general public. There have already been deaths and injuries that would never have occurred in a normal vehicle.,0.959357674
"Autonomous cars are a largely untested entity, and they have already proven unpredictable and dangerous in potential collision scenarios.",0.976226674
Autonomous cars are much more reliable than human drivers,0.946787465
"Autonomous cars are a moral gray area waiting to happen, and development should be stopped until concerns about ownership of risks, safety concerns, hacking potential and abuse are addressed.",0.685284352
"Autonomous cars are a step further into a world controlled by humans, which will only be secondary.",0.509111992
Autonomous cars are a step too far in automation. Relying on automation on the road when so many unforeseen events could occur is going too far.,0.935019518
Autonomous car belongs to the future,0.026149075
"Autonomous cars are also one for the future, as they are self-driving and promote safe driving, parking and traffic.",0.001827227
Autonomous car is an accident waiting to happen,0.130606197
"Autonomous cars are basically giant moving robots, so if something goes wrong with the computer system, the car could injure or kill people.",0.858700243
"Autonomous cars are computer-controlled and prone to hacking. At this point, they can become a dangerous weapon not only for the driver, but for everyone around him.",0.940306646
Autonomous cars are dangerous and one step closer to losing our humanity,0.654354981
Autonomous cars are dangerous and make people lazy.,0.260234714
"Autonomous cars are dangerous and should not be allowed; we all know that technology often fails and that, in this way, there is no need to allow someone to risk their life (and that of others).",0.999964848
Autonomous cars are dangerous and we should stop developing them.,0.696167289
Autonomous cars are dangerous and only lead to death.,0.053674973
Autonomous cars are dangerous because they cannot make an informed decision in an emergency.,0.923363525
Autonomous cars are dangerous because they are operated by a computer that cannot function or be hacked.,0.900729463
Autonomous cars are dangerous because they can be hacked.,0.790893657
"Autonomous cars are dangerous because they are unable to make a split-second decision, as a human being could.",0.83455906
"Autonomous cars are more dangerous, more dangerous, than a single person could ever be. We rely on a computer program to decide life and death.",0.612123663
"Autonomous cars are dangerous, they rely on machines that cannot work. Terrible accidents have already occurred and people have been killed by these cars.",0.90068853
Autonomous cars are still in their infancy and the technology behind them has already proved flawed.,0.765076535
Autonomous cars are vulnerable to hacking attacks that would be dangerous,0.98974368
Autonomous cars are likely to be more susceptible to accidents than human-driven cars because they eliminate the possibility of human response and correction in unexpected circumstances.,0.886489068
Autonomous cars are probably safer than human-driven cars because they eliminate the factor of human driver error.,0.947868445
Autonomous cars are machines that only do what we tell them; they lack the human thought process that can make a split-second difference in the decision-making required to drive.,0.120684838
"Autonomous cars are no more dangerous than distracted drivers, and autonomous driving can allow drivers to perform other tasks.",0.891679029
Autonomous cars are unable to respond to specific scenarios in which decisions need to be made.,0.989714414
"Autonomous cars are unable to capture human emotions, which can help in decision-making when confronted with problems while driving.",0.881778192
Autonomous cars are not reliable enough to make their lives depend on them working properly.,0.755036814
Autonomous car is not roadworthy causing more accidents due to car programming unable to anticipate human decision,0.773796894
"Autonomous cars are not safe and can endanger people's lives by causing an accident due to a software glitch, so there is no point investing in them any more.",0.671977277
"Autonomous cars are not trustworthy in every aspect of safety, and we cannot trust the robot and its ability to react in a situation where humans react to the situation.",0.142983256
"Autonomous cars are now a reality of the future, some states have them.",0.194744075
Autonomous car is our future and offers many advantages,0.851693731
"Autonomous cars are part of the evolution of our inclusive society, which follows modern life and the demanding times we live in.",0.465814159
Autonomous cars are perfectly fine with technology that controls much more dangerous operation,0.865831686
"Autonomous cars are potentially much safer than cars driven by humans. People can be distracted, for example, by looking out of the window in a way that a machine would never be.",0.744087154
Autonomous cars are prohibitively expensive,0.008796399
"Autonomous cars are proving dangerous, there are too many variables involved in safe operation and their development should be stopped.",0.971804357
"Autonomous cars are safer because they cannot fall asleep while driving, drive drunk or take their ""eyes"" off the road.",0.893684327
Autonomous cars are safer because they rule out human error,0.999867175
"Autonomous car is safer than a human car because it does not get tired, is not distracted and does not drink or drive",0.974979362
Autonomous cars are simply the next logical step in transportation. A year ago people would have said that all cars are dangerous and we should all stick to horse and buggy instead.,0.692532832
Autonomous cars are so valuable for the future in an increasingly congested world that we need to invest more in them.,0.457128165
"Autonomous cars are still at an early stage of development, as they will take more time and energy to develop and become a viable means of transport.",0.759194774
Autonomous cars are not yet proven.,0.090876868
Autonomous cars are the best option for a safer future with fewer fatalities,0.752391026
Autonomous cars are the future and some cities already have them.,0.153121519
"Autonomous cars are the future of safety, no longer an accident because people are sleepy, drunk or ill, the car always works according to pure machine logic and is not influenced by emotions or external factors",0.850450442
Autonomous cars are the future of the automotive industry and certainly the best way to reduce the number of deaths caused by human error in the automotive industry.,0.931641599
"Autonomous cars are the future, they could prove safer than with a human driver, and their development should continue.",0.761528693
Autonomous cars are the future. Much safer than driving home drunk.,0.065979937
Autonomous cars are the only way to ensure that people who do not have access to transport or cannot drive will still be able to move around.,0.670952985
Autonomous car is the way of the future,0.000101487
"Autonomous cars are too risky on the road, hackers may find a way to take control and cause an accident",0.945991649
Autonomous cars are too unpredictable and untested.,0.770365434
Autonomous cars are not able to take all possible circumstances into account and are therefore more likely to pose a road hazard.,0.441278181
Autonomous cars are unpredictable and we shouldn't trust them,0.783057781
"Autonomous cars are unsafe, there are too many variable things happening while driving that computers and computers cannot respond to efficiently.",0.938725569
Autonomous cars are very dangerous and not sufficiently tested.,0.738043793
Autonomous cars are vulnerable to hacking and lack human skills to avoid dangerous situations that can lead to life and death.,0.960999762
The autonomous car has yet to prove itself safe and may suffer from technical glitches and faults that can lead to accidents.,0.999391373
Autonomous car can help disabled people or people with reduced mobility,0.877999292
"Autonomous cars can be dangerous and encourage reckless behavior, so they should cease production.",0.812755771
"Autonomous cars can be dangerous because they can choose to avoid one group of obstacles by crashing into another group of obstacles, the latter being more serious than the former.",0.82997558
Autonomous cars can easily be hacked by evil people and cause a variety of accidents.,0.988482777
Autonomous cars can easily be hacked to cause widespread accidents.,0.962333476
Autonomous cars can be faulty and put lives at risk.,0.917680177
Autonomous car can be hacked and become a dangerous weapon for evil people,0.926344023
Autonomous cars can be hacked and completely removed from the control of the human passenger / driver.,0.519264373
"Autonomous cars can be hacked, and this can be deadly for the passenger.",0.756337121
Autonomous cars can be very dangerous if software bugs are present and can cause more accidents,0.920389404
Autonomous cars can cause accidents.,0.617949265
Autonomous Car May Prevent Accident Due to Human Failure,0.999553819
"Autonomous cars can give many people the freedom to drive cars without actually driving, so we should not stop building them.",0.837105097
"Autonomous cars can have such an advantage that anyone can travel in a car, so handicapped and vulnerable people that others would not be able to get to another place.",0.946426062
"Autonomous cars can help people make more long-distance journeys, enabling them to arrive refreshed and anxious.",0.30759219
Autonomous car can help people to travel disabled or without a driver's license,0.868384486
Autonomous cars can help reduce congestion.,0.891959629
Autonomous cars can help those who can't drive to have consistent transportation options when they don't otherwise.,0.855920204
Autonomous car can help transport people who can't drive themselves,0.946764211
"Autonomous cars can lead to accident and death because they are unable to make a split-second decision, as humans can.",0.993378815
Autonomous cars can make driving more dangerous because their programming cannot cover every conceivable case.,0.929818715
Autonomous cars can make drying easier and safer.,0.22160731
Autonomous cars can enable people with disabilities or visual impairments to live more independently.,0.998406307
Autonomous cars can make the journey more relaxed and help the traveler arrive refreshed and happy. It can also eliminate road rage.,0.773490552
Autonomous cars can never be programmed well enough to foresee circumstances that humans can.,0.966707135
Autonomous cars cannot make a complex decision.,0.992560349
