argument,score
Guantanamo Bay is a sad excuse for a prison,2.62e-06
Guantanamo Bay is a stain on America's reputation as a lawful and just country.,0.979858726
"Guantanamo Bay is a stain on the reputation of the United States, which has acted to advance the cause of terrorists around the world",0.326518255
"Guantanamo Bay is a symbol of human rights violations, which rightly show that America is hypocritical when it comes to promoting human rights.",0.980964838
Guantanamo Bay is a symbol of Muslim discrimination.,0.001622943
Guantanamo Bay is a symbol of torture and ill-treatment that is ruining the reputation of the U.S.,0.875223169
guantanamo bay is an excuse for a supposedly democratic and just country to commit human rights violations,0.766828722
Guantanamo Bay is an important prison camp to keep the most dangerous terrorist away from the US.,0.646772849
Guantanamo Bay is an important part of our military arsenal and cannot be eliminated; it is proof that we are stronger.,0.894768125
Guantanamo Bay is an important political asset,0.005537858
"Guantanamo Bay is also important in the areas of law and defence, facilities that are needed in a world where terrorism is on the rise.",0.041052782
Guantanamo Bay is an important tool in the fight against terror and shows how long we are prepared to fight the enemy.,0.964514859
Guantanamo Bay is a violation of human rights,0.157067414
"Guantanamo Bay is an inhumane camp, well hidden from the eyes of international public opinion and unlikely to guarantee a fair trial.",0.596792787
Guantanamo Bay is an illegal detention centre that tortures prisoners and exacerbates tensions between the united state and a potential terrorist sanctuary state.,0.785141317
Guantanamo Bay is used to torture and maim people without any real purpose.,0.957045017
Guantanamo Bay has hardly been used since 9 / 11 and costs the government money.,0.618662873
Guantanamo Bay is known for its unfair treatment as a prisoner and should be closed.,0.883006055
"Guantanamo Bay is needed to house terrorists, to make the world a safer place.",0.746218487
Guantanamo Bay is no longer needed and should be closed,0.82375164
"Guantanamo Bay is no longer considered a legitimate place for the detention of criminals, because we have learned that something has happened there.",0.170148413
Guantanamo Bay is not fair to Cuban citizens.,0.368285743
Guantanamo Bay is outdated and barbaric,0.126496871
Guantanamo Bay is outdated and not very useful,0.027087176
"Guantanamo Bay is outdated and should not isolate people any further, as they do.",0.674330121
"Guantanamo Bay is responsible for the torture and illegal detention of prisoners, and that is a stain on the US human rights record.",0.806914249
"Guantanamo Bay is run humanely, and the detainees receive healthy food, good medical care, and clean housing.",0.983001847
Guantanamo Bay will be managed in a humane manner that complies with international legal standards.,0.329111893
Guantanamo Bay is simply a place where the United States can torture prisoners without having to answer to the law.,0.896464745
"Guantanamo Bay is somewhere safe to house suspected terrorists, so it is necessary.",0.998526917
Guantanamo Bay still houses detainees and does what it intended to do,0.002629039
Guantanamo Bay is the best option for harboring terrorists.,0.307000338
Guantanamo Bay is the best place to detain the people there; it is far too dangerous to bring them into the state.,0.777753654
"Guantanamo Bay is the place where many war crimes have been committed, torture and indeterminate mention, many people have been released for lack of evidence and it is a stain on our history.",0.654712493
"guantanamo bay is a tool to crush individual terrorism suspects in order to avert other acts of terrorism, and should therefore be kept open in the fight against terrorism.",0.953744426
"Guantanamo Bay is a sanctuary for terrorists; if we close it, they could be brought to a place where it would be easier for them to escape.",0.482034952
"Guantanamo Bay is used to house the worst terrorists; if we close it, they could be kept in a safe place.",0.272967871
"Guantanamo Bay is, overall, a net gain in the fight against terrorism, and we should not close something that works because of a few cases of poor treatment.",0.746639512
Guantanamo Bay is holding suspected criminals in a place where they cannot pose a danger to the American people.,0.862384588
guantanamo bay keep the dangerous terrorists away from our civilian population.,0.829817048
Guantanamo Bay maintains terrorists who pose a threat to the united state and hold foreign prisoners so that they are not sent back to their country to commit continued acts of terrorism.,0.902859078
"guantanamo bay makes others think twice before attacking the country, saving many lives.",0.001338199
Guantanamo Bay could be used for another purpose,0.000490262
guantanamo bay must remain open. Terrorists and those who would try to harm u must know the punishment they will incur for taking action against u.,0.634032881
"Guantanamo Bay must be closed because it is not a safe place, not even for the criminal being held there, or, more specifically, for them.",0.457228591
guantanamo bay no longer serfdom the purpose it did because of the controversy,0.4669301
Guantanamo Bay operates in accordance with international legal standards.,0.008574226
Guantanamo Bay detainees are subjected to torture that violates our law and morals and should be shut down.,0.926831742
"Guantanamo Bay encourages the unlawful detention and torture of detainees, and their very existence worsens the relationship between the united state and the country that could harbor potential future terrorists.",0.889755843
Guantanamo Bay is a place where terrorists can be safely interrogated and detained.,0.959750595
Guantanamo Bay is a place to detain terrorists away from the large population center.,0.576168608
Guantanamo Bay provides a safe place for people who would otherwise pose a threat to innocent people.,0.872961838
Guantanamo Bay provides a safe place to house those who pose a real threat to national security.,0.930781525
Guantanamo Bay provides valuable service in the war on terror,0.013496194
"Guantanamo Bay offers a way to obtain information about terrorist cells, potentially saving American lives.",0.256861274
Guantanamo Bay provides intelligence that can crack terror cells and prevent future attacks.,0.957416272
"guantanamo bay amounts to a decree allowing him to detain prisoners without trial, which violates a fundamental right and almost certainly means that prisoners who are innocent are being held.",0.936009011
Guantanamo Bay serfs have no other purpose than to commit cruel human rights violations in the name of protection. Half of the detainees are not even demonstrably guilty. It is an embarrassment to democracy.,0.787123367
"Guantanamo Bay serf to prevent dangerous killers from committing further acts of terrorism, and is an invaluable intelligence weapon that collects weapons.",0.993287691
Guantanamo Bay should be closed to damage the image of the United States.,0.827867756
"Guantanamo Bay should be closed because it violates human rights, does not meet international standards and is known to torture prisoners",0.883152202
Guantanamo Bay should be closed because it serves no purpose.,0.184946253
Guantanamo Bay should be closed because of the cruel and inhumane conditions.,0.836711272
"Guantanamo Bay should be closed, it is barbaric in its treatment of prisoners and it costs taxpayers even more.",0.786604768
"Guantanamo Bay should be closed, violating the human right to torture and indefinitely detain men, many of whom have never been tried or convicted.",0.981554648
Guantanamo Bay should be kept open because it is a safe place to hold very dangerous people,0.796070747
Guantanamo Bay should not be closed because it is capable of accommodating dangerous criminals successfully.,0.898599711
"guantanamo bay should remain open, as it can be a good deterrent to future terrorist attacks. Treatment of the detainee is acceptable, as most of them were prepared to kill many Americans.",0.719289979
Guantanamo Bay should not be closed because it holds terrorists that many countries do not accept,0.645112777
Guantanamo Bay still harbors criminals and prevents them from harming the public again,0.967314557
Guantanamo Bay Treats Detainee Barbaric; It Must Be Closed,0.897241841
Guantanamo Bay weighs on US citizens undemocratically in terms of freedom and finances,0.886448672
"guantanamo books us torture of his prisoner, which is cruel and inhumane.",0.273210912
Guantanamo Bay violates many international agreements on the treatment of prisoners.,0.999998208
guantanamo bay violates the procedure provided for in the Constitution,0.998705504
Guantanamo's history of torture and other constitutional violations runs counter to American values.,0.839028381
Guantanamo's treatment of detainees violates Geneva Convention,0.974744519
Guantanamo fuels resentment among inmates and makes them more likely to turn to terrorism when they are released.,0.665487906
Guantanamo can provide security for suspected terrorists who would be harmed in the general prison population.,0.080358551
"Guantanamo offers America no security, because it holds only about 100 people.",0.026198129
Guantanamo harms America's image abroad and complicates diplomacy.,0.932025194
guantanamo was a place of torture and must be closed.,0.769595385
Guantanamo has destroyed the reputation of the United States as the leader of the free world.,0.977919908
Guantanamo holds only a handful of prisoners and is not a gulag.,5.57e-13
guantanamo is a human rights disaster and we cannot continue to support it.,0.710234157
guantanamo is a torture center and must be closed,0.771119781
guantanamo is a violation of Cuban sovereignty and must be closed,0.973080771
"Guantanamo is cruel and dangerous, and therefore an unethical form of punishment.",0.999727913
Guantanamo is expensive and therefore a theft from taxpayers with no real benefit.,0.088907886
Guantanamo is much safer than most prisons and prevents the worst criminals from escaping.,0.858998039
"Guantanamo is a small potato compared to America's vast prison complex, so the relatively low level of injustice there is not our biggest concern.",0.003427355
"Guantanamo is synonymous with abuse and injustice, and that will not do the US any good in the long run.",0.998692113
"Guantanamo is unpopular, making it an undemocratic form of government policy.",0.026072794
Guantanamo is being used as a symbol that radicalises potential terrorists.,0.964958785
"guantanamo serfs have an important purpose in safely accommodating foreign suspected criminals for deportation or trial, while keeping u ground safe from reprisals for these people.",0.406351579
"guantanamo should be closed, it is a semi-lawless operation that is a symbol of the repression of immigrants suspected of criminal behavior.",0.430834752
Guantanamo is torture that violates international law.,0.974667666
"Guantanamo arouses anger around the world and kills more people than it can save, if it saves anyone at all.",0.003427355
Guantanamo Bay should be left open to another location where illegal immigrants can be housed.,0.050085213
Guatanamo Bay is needed for the worst offender.,0.091270212
Guatanamo Bay is the place where we can keep the worst offenders safe.,0.137343833
guatanamo bay works illegally because they use torture.,0.034202466
guatanamo books us torture on them prisoners and should be closed.,0.949661302
"Guilty people deserve to be punished in proportion to the gravity of their crime, so the death penalty is a just life sentence for murder.",0.997561429
Gun crime is the biggest killer in the EU and can be greatly reduced by abolishing the right to bear arms,0.723366586
Gun ownership has led to many mass shootings lately,0.897351998
Gun ownership has hurt more people than it has helped.,0.460121582
Gun ownership is a given right and should not be taken away; we should be able to have weapons for protection.,0.959517981
"In an increasingly hostile and dangerous world, gun ownership is a personal right and a form of personal protection.",0.948844443
Gun ownership only leads to more violence. Weapons sold on the consumer market today are unforgivably far too powerful for mere self-defense.,0.997661528
"Gun violence is a huge problem, and there are too many mass shootings. If people didn't have a gun, many lives could be saved. Less suicide would also happen if a gun was just too easy to use.",0.742472898
"Gun violence is at an all-time high, and getting guns off the streets should be our top priority.",0.887772395
Gun violence is on the rise and every day many innocent people lose their lives.,0.09514528
"Gun violence is spiralling out of control, and the only way to get a grip on this terrible problem is to get all guns off the streets.",0.738603024
Gun violence is out of control and guns are falling into the wrong hands,0.860592084
Gun violence is out of control and the only solution is to take the gun away,0.474838619
Gun violence kills innocent people every day.,0.845337281
Firearms and other weapons are dangerous and must be taken off the streets,0.83299373
Firearms are a constitutional right and should not be withdrawn,0.742472898
"Firearms are already ubiquitous, and a ban will only keep them out of the hands of the rightful owner.",0.609172013
Weapons are there to kill people and we should do everything we can to destroy them and stop their production to save lives.,0.810971042
Guns are far too dangerous and often fall into the wrong hands,0.54596821
Firearms are not allowed in most European countries and crime is lower there.,0.681758284
Gun often ends up in the wrong hand and causes murder.,0.602874942
"Half the marriage gets divorced, so it's best to get rid of it altogether",0.601767672
"Damage from cosmetic surgery is not a foregone conclusion, but it has developed and will become a real problem in the future and a real danger to our body.",0.341512868
"It has been proven that so many whale populations were in danger of disappearing, and a ban on whaling is imperative for mankind.",4.34e-05
Hate groups are making this a scene of violence and hate crime.,0.537459637
Having a well-educated workforce is good for the country,0.178619301
"Children's acts have exposed them to a great deal of pressure and fame, which many struggled with later in life.",0.081755933
"have only one party that centralizes everything, with the chance of a split",0.023488527
A balanced budget is the key to a long-lasting and manageable country that is debt-free.,0.147634394
A balanced budget is very important for a country and its well-being. It is worth trying something new when what you are doing is not working.,0.173870351
"If you have a busy life, you have very little time to prepare a meal. Fast food allows people to eat their meal on the go.",0.926452235
Having a child through their own genetic material is incredibly important for almost everyone. Some people are not able to give birth through no fault of their own. Surrogacy is their only way to do this.,0.92440028
Why should we subsidise people who have chosen a child they cannot afford?,0.969397718
Having a child that is genetically linked to you is very important to many people.,0.052672471
Having a different perspective and argument could mean a fairer outcome.,0.352650581
"Having a family should be something planned, one cannot expect to be paid for a child, both parents should actively participate in the development of society instead of being a burden.",0.85133631
Having a father close by can help a child's development,0.009359786
Compulsory retirement is good for making the job easier for younger people,0.996173743
A mastectomy is devastating for many women and society needs to give them the chance to look normal again.,0.7577023
A multi-party system opens the door to many opinions and can create more confusion for those who do not understand politics,0.774335464
Possession of a nuclear arsenal is the only way to keep dangerous nations like North Korea at bay.,0.363031012
An austerity regime is a good thing to have a good and obedient citizen.,0.027978118
An austerity regime does not mean freedom.,0.146606996
"Executive pay creates a lot of instability because of unequal pay, and people should always be able to know how much money they are getting.",0.391056863
Intellectual property rights impede progress and prevent others from developing and improving projects,0.869903105
"The right to intellectual property is a deterrent to those who would steal another person's ideas and creations, so we must not abolish it.",0.924370127
It is easier to have only one party in power without opposition than to have to constantly change the law to reflect differences of opinion,0.49775193
"A multi-party system is a complete mess, because people are confused by the choice they have to make.",0.450471973
"If you have a multi-party system, you don't know who to vote for, and everything gets messed up.",0.411209931
"To have married several women to one man is completely immoral, a well that is confusing for the child.",0.293637768
"If nuclear weapons have a deterrent effect on other nations that also have nuclear weapons, it means that they will not use theirs against them, and we would retaliate to wipe them out, too, to prevent war.",0.142828463
Nuclear weapons actually keep the nation from going to war because they fear it could escalate,0.874469463
"Having nuclear weapons that give a country power in today's politics, and abolishing them, is not an option.",0.240885885
"The availability of nuclear weapons sends a strong message to potential enemies, and is also a huge plus for global diplomacy.",0.480417992
Nuclear Weapons Increase Nation's Power and Status,0.019430516
Possession of nuclear weapons is a safeguard that ensures that other countries with nuclear weapons are unlikely to launch an attack.,0.693330293
"Nuclear weapons reduce the likelihood of nuclear war, because no one will engage with a country that uses them because they are being used, and the war will end immediately because the country will be wiped off the map.",0.843071686
Possession of nuclear weapons provides good defense and a strong offensive against a threatening country.,0.757442279
"Letting people work past retirement age halts the natural movement of the worker on the career ladder, because there is no natural end point.",0.48087217
More open prostitution would lead to a cover-up of even more serious crimes such as child trafficking,0.080278352
Racial profiling is improving in country statistics and there is nothing wrong with that.,0.015604352
"Today, Racial Profiling is only a plus in the global fight against terrorism.",0.008431669
A safe place keeps college students from being prepared for the real world,0.215062055
Having a safe space is pandering to a new generation that can't cope with the real world and has to hold hands to get through life.,0.719025969
A safe space isolates a group of people rather than exposing them,0.003048779
"Since there are so many things to support, the state does not need another compulsory subsidy.",0.058577805
"If we have so much to support today, from schools, hospitals, road construction to ending affirmative action, it will be a huge plus to support such a case.",0.068741342
Having someone from outside the tradition judged can be good in many cases,0.110643375
"The possibility of trading in organs would be a perverse incentive to harvest organs from otherwise healthy people, as can be seen in the organ harvesting by Uighur Uighurs in Asia.",0.943837853
This compensation ensures that executives continue their work properly,0.063815253
Having too many choices will confuse some people,0.006130246
Too many celebrations confuse matters and cause chaos,0.704849885
Health professionals should adopt a science-based approach and naturopathy is based on pseudoscience,0.117347353
"Health research deserves government funding, and embryonic stem cell research is a promising area to be prioritized, as it will have an impact on the treatment and cure of many diseases.",0.978262563
Helping a person commit suicide devalues human life and can lead to the death of unstable people who are mentally incapable of making the decision. It should be criminalised.,0.955594124
Aid for embryonic stem cells will help couples to have a child who was not lucky enough to have their child naturally.,0.004036288
"Aid to our government and our country is mandatory for all of us, and an austerity regime must be put in place.",0.659674795
"There are many tools to help people through bad times, and helping them die is like pulling the trigger.",0.669385937
Helping people to have a house and an apartment is mandatory for all of us with the support of our government.,0.007949266
Helping someone commit suicide is like killing yourself.,0.196225009
Helping someone commit suicide is murder,0.250002864
Helping someone commit suicide is murder and should be criminalised,0.948921883
Helping someone to commit suicide is nothing other than murder and must be a criminal offence. Life is sacred and must always be regarded as such.,0.934420359
"Helping someone to die should be a criminal offence, otherwise unscrupulous people could get away with murder by controlling someone under duress and encouraging them to take their own lives.",0.050853841
"When it comes to solving major crimes, detention is sanctioned and should be legalised.",0.003852631
"Urbanization aid should be mandatory for our council and our government, because it is not the most important aid in people's lives.",0.00499358
Help for the younger generation is mandatory for us and we help them to shape our future.,0.006866086
Help u with the prison the field of detection of Guantánamo Bay,1.71e-07
"High performers demand a high salary. Their simple economics, stupid.",5.54e-05
High executive salaries are necessary to get the best manager for your company,0.731596571
High urbanization creates a wall between rich and poor with projects and slums,0.462545817
"Higher education is no longer so useful for finding a job, we need to stop pumping money into it.",0.982239093
"Higher education is not an inherent right. If someone wants to go to college, they should pay for it. Taxpayers should not simply shoulder the burden.",0.875675336
"Higher education leads individuals to become productive members of society, paying taxes, so the state should help people pay for that education.",0.950146142
Higher education should be a right; subsidized student loan provides access to education for all who want to learn,0.878957482
"Higher education, such vocational training, should only be paid for by those who take part, otherwise there would be a lot of wasted resources with dropout rates.",0.51009741
"Quality journalism requires time, expertise and research. All of this requires money.",0.732177813
"Historical stereotyping still creates implicit and explicit bias within the employer and college admissions programs, and we therefore need affirmative action to counter that bias.",0.917253036
"Historically, austerity has led to unemployment.",0.932452623
"Historically, the United States has taken the lead by providing robust protection to patented inventions and facilitating the dissemination of the market for patent rights.",0.00347502
Keeping people without trial is wrong,0.264690871
"Hollywood has a bad influence on the child. Child actors have a higher rate of substance abuse, mental disorders and suicide.",0.922135188
Home education is equal or better than in an institution,0.153985648
Children who go to school at home have a high test score.,0.104641795
"Home schooling can be better for some children, especially children with special needs who cannot be adequately looked after in a school.",0.997121333
"Home schooling deprives the child of natural interaction with other children his or her age, establishes new friendships, and learns to deal with children who are different from him or her.",0.702897845
Home schooling does not provide the quality of education that is provided in educational institutions and social interaction,0.995910543
"Home schooling is a good alternative for many. It is economical, safe and a better environment for a child. Parents have the right to decide what is best for their child.",0.889480636
"Home schooling is a good alternative to traditional schooling, and the child who is home schooled shows similar results to the child who is traditionally schooled.",0.682275376
"Homework support is not separation, but direct integration into the local community, children get to know their own community much better",0.67750031
"Home schooling is not a good regular school, because parents are simply not equipped for a teacher to educate their child.",0.148705203
Homework support provides a safe learning environment without rampage and bullying risk,0.994084038
Homeopathic and naturalistic propaganda harms such a reduced use of vaccines.,0.493761904
homeopathic remedies are so strongly diluted that they contain no active ingredient and are therefore harmless,0.008255687
Homeopathic medicine can be effective in treating certain diseases without intensive modern medicine.,0.99671112
"Homeopathic medicine can be expensive, although it offers no benefit.",0.863891089
Homeopathic medicine can be used alongside modern medicine to improve the well-being of patients.,0.999026617
Homeopathic medicine can often complement a patient's prescribed medication.,0.971692278
Homeopathic medicine contains no active ingredient and therefore cannot cure diseases. People who take it instead of conventional medicine are more likely to fall ill.,0.99955188
The dosage of homeopathic medicines can be dangerous because the doctor cannot control it.,0.204142217
