argument,score
"Homeopathic medicine gives people false hope and delays their search for genuine medical treatment for their condition, which can lead to a deterioration of their condition and possibly death.",0.888816493
Homeopathic medicine is an exploitative industry that often makes unsubstantiated claims about its effectiveness.,0.998668092
Homeopathic medicine works no better than a placebo.,0.481282694
Homeopathic medicine is boycotted by Western medicine because of its low cost and all natural healing methods.,0.032209914
Homeopathic medicine is not addictive.,0.51208166
Homeopathic medicines are not clinically tested and can kill people,0.988206289
Homeopathic medicines are often diluted to such an extent that they contain no active ingredient and are therefore harmless.,0.895353505
Homeopathic medicines are usually safe for pregnant women and children.,0.427456808
"Homeopathic medicines are usually used for chronic diseases that are not life-threatening and can alleviate the symptoms for some followers, but if not, there is no harm because the substance is natural.",0.874054017
"Homeopathic remedies are a waste of money, they are watered down and do not work.",0.966620019
Homeopathic remedies are more natural and harder than pharmacological treatments.,0.756910768
Homeopathic remedies are not as addictive as conventional medicine can be.,0.979517121
homeopathic remedies are not medically tested and confirmed as safe.,0.590429668
Homeopathic remedies contain no harmful ingredients.,0.144649526
Homeopathic remedies do not suppress the immune system.,0.000314754
Homeopathic remedies have been shown to be useful in many diseases and to shorten the duration of a cold.,0.942266708
Homeopathic remedies do not contain an active product and are usually prescribed as an alternative to proven medicines that could interfere with the actual cure.,0.493375324
Homeopathic treatment can worsen an individual's condition and pose a risk and danger to his or her life.,0.999807591
Homeopathic treatments are based on natural ingredients and are best for the human body.,0.989146731
Homeopathic treatments increase the natural healing power of the body.,0.544572154
"Homeopathic treatments generally do not improve the condition of patients and are often used as a substitute for conventional treatments, which would be more helpful.",0.997839371
Homeopathic treatments have been around for years and have helped many people during this time.,0.964658018
"Homeopathic treatment can take a long time for a disease to be effective, which can lead to some diseases getting worse because they have not been treated quickly enough.",0.704116845
Homeopathic treatments often do not provide a lasting cure for a disease.,0.487614788
Homeopathic treatment often does not have the serious side effects of conventional medicine,0.877999292
"Homeopathy creates the mindset that such a vaccine can be replaced, which in turn can cause the death of others.",0.96727351
Homeopathy cannot be scientifically proven.,0.427037474
"Homeopathy deals with the root cause of a problem, not just its symptom.",0.002052884
"Homeopathy deals with the root cause of a disease and not only with its symptom, a symptom of conventional medicine.",0.938996373
Homeopathy addresses the root cause of the disease and works to tackle the disease itself in a different way than it is symptomatic.,0.231311147
Homeopathy enables natural healing and care instead of exposing oneself to an unknown danger of chemical substances.,0.713817972
"Homeopathy allows too many unqualified people to use everything they want to try and help people, and it can lead to people being exploited",0.704996667
Homeopathy enables the treatment of those who are looking for an alternative to unnecessary medicines.,0.774043067
Homeopathy comforts those who believe in alternative therapies or who are otherwise allergic to medicines.,0.883677144
Homeopathy does more good than harm when used alongside traditional medical treatment to further alleviate pain.,0.949771391
"Homeopathy brings more benefit than harm. It is inexpensive and, compared to conventional medicine, only a natural option.",0.264613855
"Homeopathy does more harm than good because it causes people to delay obtaining medical help, which could negatively affect their healing time or chance.",0.99424054
Homeopathy does more harm than good because people are given false information about the actual effect of homeopathic treatment and would expect an untenable result.,0.999972796
"Homeopathy does more harm than good, because some people do not want to have any other way of getting help, even when they really need it, and for this reason they can cause others to become really ill.",0.231284808
Homeopathy brings satisfaction to some people,0.049518358
Homeopathy brings tangible results for many ailments and is an alternative to more expensive forms of treatment.,0.936389332
Homeopathy can sometimes help those where modern medicine has failed.,0.912895087
Homeopathy can be a palliative for patients whose condition is already fatal.,0.808694294
Homeopathy can be a treatment that works well with other prescribed medicines,0.007180854
Homeopathy can be beneficial to the patient as it uses natural remedies without the harmful chemical and ingredient that the pharmaceutical industry brings into its product.,0.924585033
Homeopathy can be dangerous and is not regulated,0.981688781
Homeopathy can be dangerous because there is no real oversight of the company that produces homeopathic products,0.999315206
Homeopathy can be harmful when patients stop taking prohibited medicines.,0.045670843
"Homeopathy can be harmful to those who use it, as it has not been scientifically proven to have the same effect on a traditional medicine prescribed by a doctor.",0.877208851
Homeopathy can be helpful to alleviate and alleviate many ailments at a fraction of the cost of medicines,0.928109735
Homeopathy can be misleading and result in people not being treated properly.,0.870262609
Homeopathy can be very expensive and therefore not everyone can afford it.,3.92e-05
Homeopathy can raise false hopes of curing a disease and discourage people from going to the doctor.,0.999990445
Homeopathy can do more harm than good if someone has a disease and uses homeopathic remedies without seeking medical advice,0.99998023
Homeopathy can cause dangerous interactions with medicines.,0.861072951
Homeopathy can do more harm than good because insufficient research has been carried out into the remedy and it can ultimately lead to death.,0.717006005
Homeopathy can cause more problems if people do not really know the underlying medical problem.,0.857368253
"Homeopathy can result in people not seeking valid medical help for diseases, leading to death or prolonged illness.",0.961130267
Homeopathy can promote health and well-being.,0.850036949
Homeopathy can have harmful ingredients in large quantities,0.494418792
Homeopathy can cure people through the placebo effect if they believe in it.,0.978711726
Homeopathy can help people to better control their health.,0.946163546
Homeopathy can help people with Munchausen syndrome because it can give them the feeling that they have actually been treated correctly.,0.004271266
Homeopathy can help against colds and flu.,0.55083186
Homeopathy can interact poorly with real medicine.,0.999991163
Homeopathy may interfere with prescription medications.,0.987849249
Homeopathy can prevent some people from getting life-saving medicines.,0.961683247
Homeopathy can cause people to use herbal remedies and not seek help for major problems that can have devastating consequences.,0.969768333
Homeopathy can give hope to people who cannot afford traditional medicine.,0.914748938
"In addition to modern medicine, homeopathy can be a complementary treatment.",0.952133596
Homeopathy can be an alternative to conventional medicine when all else has failed. At least it gives some hope.,0.965771629
Homeopathy can bring relief in the form of the placebo effect,0.896197278
"Homeopathy can prevent people from receiving adequate medical care, which could result in them not recovering as they should.",0.95842795
Homeopathy can discourage people from seeking appropriate medical help,0.9991496
Homeopathy can treat certain diseases and has been around for a long time,0.545007588
"Homeopathy can treat symptoms without identifying the cause of the condition, which can allow it to remain undiagnosed for a little longer.",0.157262645
Homeopathy cannot cure diseases and has been used by con artists in the past.,0.600634335
Homeopathy is harmful because it is not regulated.,0.753034473
Homeopathy could help alleviate minor ailments and also prevent future complications,0.87171328
Homeopathy could help some to find a cure when the traditional method has not worked,0.635594088
"Homeopathy could lead people to believe that regular medical treatment is not necessary, which could have negative health consequences.",0.953264653
"Homeopathy does more harm than good. It is essentially just a placebo, it does not cure anything and people are led to believe that it is a genuine medical practice.",0.78590253
"Homeopathy is not subject to the fda standard and regulations, so the practice may pose a risk to a person's health",0.140813954
Homeopathy does no more harm than good because it is alternative medicine and some people believe that it is helpful in healing people.,0.03715825
Homeopathy does no more harm than good because some people do not believe in it because of their religious faith,0.000365551
Homeopathy Doe brings no more harm than benefit because its product with natural ingredients is fairly safe,0.351382064
"Homeopathy does no harm, even the placebo effect has been shown to be effective in some patients if they believe it will cure them.",0.953410731
Homeopathy does not cure diseases and should not be used,0.06094614
"Homeopathy doesn't have enough research to prove it works, so people potentially put too much faith in something that won't work.",0.515694429
"Homeopathy does not have the same science to support it as traditional medicine, and therefore its use to treat diseases can lead to more harm or deterioration of health.",0.680002179
Homeopathy does not include the use of addictive substances,0.677456294
"Homeopathy works for many to make them feel better, and that does no harm.",0.014852961
Homeopathy does not have the same scientific support as traditional medicine,0.851587206
"Homeopathy does no more harm than good, because sometimes regular treatment by a doctor is not necessary for the condition of the person.",0.022189478
Homeopathy does no more harm than good. There are many studies that show that the body can heal itself.,0.880758462
Homeopathy encourages sick people to forgo modern medicine in order to participate in unproven treatments.,0.888605092
Homeopathy expands the field of medicine and creates more research and discourse.,0.881364739
"Homeopathy for things like appendicitis or cancer is useless, the body cannot treat it on its own and you need a doctor.",0.144907247
"Homeopathy creates a false sense of solvency, which can make the underlying medical problem worse.",0.93318415
Homeopathy gives a person the freedom to do something holistically.,0.004988025
Homeopathy has a long history in the treatment of diseases.,0.687561983
Homeopathy has proven to be a safe and effective method of treating many symptoms.,0.540049376
"In some cases, homeopathy has proved to be more effective than modern medicine.",0.998125322
"Homeopathy has been shown to have a successful effect on many people, so if the end result is good, it is worth trying.",0.620474963
"Homeopathy has been shown to help some people overcome, or at least deal with, some symptoms.",0.124849083
Homeopathy has been shown to be effective in many different studies.,0.264712431
Homeopathy has been shown to eliminate the symptoms of many diseases.,0.719363299
Homeopathy has been shown to help relieve pain.,0.886369452
Homeopathy has been shown to help alleviate the duration of a cold,0.569481703
Homeopathy was already used before the invention of medicine and has proven itself in many diseases,0.952370542
"Homeopathy has been used since the beginning of time, is non-addictive and contains no harmful chemicals present in the pharmaceutical industry.",0.519350488
Homeopathy has existed for thousands of years and is associated with many cures,0.881082023
Homeopathy has helped many people with unconventional methods,0.244909407
"Homeopathy has done it to us, there are many natural treatments for common ailments that do not cost what a doctor asks for, and they have a side effect as medicines.",0.915970847
Homeopathy has a large amount of ingredients and can be harmful,0.012421676
"Homeopathy has at least no scientific basis, it delays the application of a proven medical solution to a problem; at worst, it can be dangerous.",0.831788236
Homeopathy has no scientific basis and could dissuade people from a truly effective treatment,0.781389387
Homeopathy has no scientific evidence of its effectiveness and is tantamount to not taking any medical measures at all.,0.598507735
Homeopathy has no scientific basis,0.766395555
Homeopathy has not been proven in clinical tests.,0.460328454
Homeopathy has been shown to be useful in studies,0.552931524
"Homeopathy has absolutely no foundation in medicine and is a treatment offered only to deprive potentially vulnerable, desperate people who need hope of money.",0.88693825
"Homeopathy has value, even if it only elicits a placebo response.",0.988323486
Homeopathy helps to cure some diseases without using unnatural medicines that can have serious side effects.,0.995437941
"If homeopathy is not applied correctly to many diseases, it could aggravate them.",0.886791415
Homeopathy is a better method of treating a person because most remedies have a natural meaning and can harm the body than chemically induced remedies.,0.76605137
Homeopathy is a cheaper option for people who have little money and sometimes need help.,0.668972808
Homeopathy is a dangerous option for many people because it is poorly regulated and the product is readily available without advice or consideration of pre-existing ailments.,0.796633807
Homeopathy is a wrong treatment and causes people to take a placebo.,0.025730822
Homeopathy is a great alternative for those who do not trust chemicals in their body.,0.926344023
Homeopathy is a great way to cure or alleviate a disease in a natural way,0.367990847
"Homeopathy is a much better treatment than traditional treatments, which do not consist of a treatment with a range of chemicals that can also do more harm than good.",0.423641705
Homeopathy is a natural medicine with no side effects,0.877665899
Homeopathy is a natural method of healing or relief,0.697260209
Homeopathy is a natural method of curing a disease.,0.018578034
Homeopathy is a safe alternative to a modern medical system that relies on over-prescription of harmful medicines.,0.789549686
Homeopathy is a safer alternative to modern medicine and has more serious side effects than most medicines.,0.779974036
Homeopathy is an available alternative to conventional medicine that brings comfort to many people.,0.277599875
Homeopathy is a way to feel better in the body without chemical treatment.,0.936157749
"Homeopathy is similar to a placebo and rarely, if ever, really works.",0.803260618
Homeopathy is an affordable way to treat yourself.,0.933613504
Homeopathy is an alternative medicine without side effects,0.825804012
Homeopathy is an effective alternative to medicine for those who prefer to help their body heal naturally rather than using synthetic medicines.,0.747377083
"Homeopathy is a costly waste of time for most people, because it can't really cure anything and people are led to believe that they will work because they are natural.",0.963318385
Homeopathy is better than alternatively prescribed medicines that have serious side effects.,0.813523746
Homeopathy is currently unregulated and is not tested for safety.,0.931422128
Homeopathy is dangerous and unregulated,0.08676594
Homeopathy is dangerous because it is ineffective and virtually water. People delay or deny life-saving treatment for something that does not work.,0.852398192
Homeopathy is dangerous because it is not regulated.,0.897465893
"Homeopathy is dangerous when it is the only way to cure diseases; it works only as a placebo, not as an effective cure.",0.954752797
"Homeopathy is essentially a placebo, and those who rely on it instead of seeking real treatment risk serious complications in otherwise treatable diseases and conditions.",0.982410965
"Homeopathy experiments with medicine and is not supported by Western medicine, and such a bad option of cure and prevention should be banned immediately.",0.880293884
"Homeopathy is harmful due to misleading claims and sellers, a thoroughly pretended treatment a remedy when it has no real effect.",0.941617547
Homeopathy is harmful insofar as there is no evidence to date that it can cure any disease. Homeopaths deceive only hopeless patients.,0.213448849
"Homeopathy is terrible because it leads to people not being treated by a licensed doctor, which can make their symptoms worse and even spread disease if they do not use antibiotics.",0.94425662
Homeopathy is junk science; its application delays proven treatment while the serious disease worsens.,0.452695798
Homeopathy is just a wild theory that what hurts one person can cure the same symptom in another. Such assumptions are at best unscientific and at worst expose people to potential harm.,0.939674056
"Homeopathy is only a good traditional medicine and cures a considerable number of people, which means that doctors can concentrate on treating people with the most serious diseases.",0.922807478
Homeopathy is only an alternative treatment to conventional medicine; it could be effective in people who do not respond well to conventional medicine.,0.920795161
"Homeopathy is only an alternative therapy, one could look for a hard, a dangerous alternative to standard medicine.",0.975991497
Homeopathy is more effective in preventive medicine because there is rarely a relapse in intake.,0.896628176
Homeopathy is much more dangerous than many medicines,0.821434019
Homeopathy is natural to us and therefore healthy.,0.145645415
Homeopathy is natural and therefore healthy.,0.07428634
Homeopathy is not a conventional method of curing diseases. It lacks evidence and support and would only endanger sick people.,0.559232057
"Homeopathy is not a proven solution, and people are not seeking medical treatment that could potentially save their lives.",0.979430154
"Homeopathy is not a recognised profession, so anyone wishing to practise it can do so without qualifications or knowledge of the human body.",0.670580835
Homeopathy is not driven by pharmaceutical lobbyists and politicians,0.053314829
Homeopathy is not fda-regulated and can lead to death.,0.484348515
Homeopathy is not regulated by law and there is no obligation to formally train a homeopathic expert or physician.,0.927878405
Homeopathy has not proven itself as a modern medicine,0.927036474
"Homeopathy is unregulated and anyone can practise it, it is harmful and harmful.",0.000288176
Homeopathy is not regulated or investigated.,0.930047324
Homeopathy is not safe and should be banned.,0.941713703
"Homeopathy does not treat the disease effectively, but with a placebo effect.",0.040086568
"Homeopathy is not well regulated, so people do not know the dangers of using homeopathic remedies.",0.943587025
Homeopathy is often not supported by extensive research,0.400928163
"Homeopathy is pseudoscience, plain and simple: the medicine used in homeopathy does not treat anything, and homeopathy can be very dangerous if people seek it instead of conventional medicine.",0.959343015
"Homeopathy is pseudoscience; its medicine is nothing more than water, and it can be particularly harmful if it prevents people from seeking a doctor or a science.",0.999732358
Homeopathy is scientifically implausible and produces nothing more than a placebo effect in patients.,0.964603195
Homeopathy is scientifically unproven and therefore poses a health risk.,0.98161338
"Homeopathy is sometimes used by people instead of traditional medicine, which can lead to unnecessary deaths.",0.974387196
"Homeopathy is the basis for many other traditional medicines, and they can be very effective in reducing symptoms, treating minor ailments and without major side effects.",0.955854239
Homeopathy is the only alternative for people who lack the money for expensive laboratory medicines,0.49893056
Homeopathy is the only option for many people,0.981711126
Homeopathy is unknown and unpredictable,0.581332982
Homeopathy is unproven and can be harmful,0.379226452
"Homeopathy is unregulated, and not all practitioners are aware of the potential dangers of such a practice.",0.863184054
"Homeopathy is untested and unsupported by scientific evidence, leading to a dangerous outcome where unqualified doctors can see vulnerable patients.",0.997033149
Homeopathy is untested and unregulated. There is no safety net to ensure you consume an uncontaminated product. Many people have died or fallen seriously ill as a result of contaminated homeopathic products.,0.98266519
"Homeopathy is used as a substitute for traditional medicine, which can leave serious diseases untreated.",0.999906754
"Homeopathy is mainly used in culture, which should be respected.",0.424659368
Homeopathy is not fda-approved and can cause all sorts of problems and side effects.,0.564331431
Homeopathy discourages people from taking unnatural medicines that alter their bodily function.,0.733688114
Homeopathy lacks scientific evidence and may be counterproductive rather than beneficial to people.,0.893408386
"Homeopathy leads people to believe that their serious illness can be cured without conventional medicine, and discourages them from taking medicines or pursuing a treatment that would actually help them.",0.999455061
Homeopathy causes more people to overdose than normal medicine because it is not supervised by a real doctor.,0.425296692
Homeopathy makes anyone who has read a little on the Internet think they know better than a trained doctor.,0.818714005
Homeopathy can prevent some people from receiving the medicines that could save their lives.,0.84381364
"Homeopathy may not be the best choice, but the benefits of its use have been proven beyond doubt in many cases. Alternative medicine gives people the freedom to decide what enters their body.",0.877773478
"Homeopathy means that people do not seek adequate and timely medical treatment, which gives false hope and puts their long-term health at risk.",0.940374135
Homeopathy is not proven and could have harmful side effects for the person taking it,0.974687708
"Homeopathy must be used with care, a home remedy does not always have what it takes to really treat a patient.",0.516181245
Homeopathy often gives people hope of curing a disease that can never be cured without modern medicine.,0.608346907
"Homeopathy offers a substitute plan when modern medicine has failed the patient. If patients have exhausted all other medical possibilities, homeopathy gives them another chance of recovery.",0.921157238
"Homeopathy offers great relief, often in addition to conventional medicine, and is a gentle and natural method of treating a lot of ailments.",0.910986985
Homeopathy offers people an alternative and hope that all traditional medicine has failed.,0.835291463
Homeopathy is an alternative for people and can offer them another way of finding a solution to a particular problem.,0.998974836
Homeopathy is an alternative to taking medicines against diseases,0.42767037
Homeopathy offers false hope of cure,0.601210952
Homeopathy is a natural remedy against diseases.,0.943921387
Homeopathy offers a possibility to people who no longer have one.,0.009736497
Homeopathy offers some relief to people who do not go to the doctor.,0.816667614
Homeopathy offers symptom relief without many of the side effects that are common with common medications.,0.967897969
Homeopathy studies have shown it to be an effective placebo and could discourage followers from seeking treatment that would alleviate their condition.,0.958375325
Homeopathy treatments are not tested to see if they really work,0.794004947
Homeopathy tricks people into taking ineffective remedies instead of ineffective remedies.,0.765340012
Homeopathy gives us natural ingredient that does no more harm.,0.865157289
Homeopathy gives us natural remedies that have little to no side effects on the body.,0.723447759
Homeopathy us organic and natural ingredient,0.514470322
Children who are home schooled get a much better relationship between adults and children. They can take advantage of current weather events etc. by being flexible in their curriculum. There is also a lack of peer pressure.,0.798425002
Teachers often have no training and may not be qualified to be responsible for bringing up children.,0.940365223
Pupils do not acquire the social skills they need as they grow up.,0.916053906
Children who go to school at home are not properly socialised and may have difficulty adapting to the general population,0.928011175
Home schoolchildren fare much better on standardized tests,0.89586279
"Homeschooled child does not always come into contact with other adults, meaning that they can be abused and no one knows",0.402839978
Homeschooled child lacks basic education and social cohesion schooled child is taught.This impedes the proper development of the child,0.326420789
Homemade child performs very well on standardised test when taught in public school,0.991474301
Children who are home schooled do not get the education they need and cannot work on their social skills,0.842656982
